Unnamed: 0,title,inst1,inst2,inst3,inst4,inst5,inst6,inst7,inst8,inst9,inst10,inst11,inst12,inst13,num_academia,num_company
0,Latent Domains Modeling for Visual Domain Adaptation,,,,,,,,,,,,,,0.0,0.0
1,Learning Compositional Sparse Models of Bimodal Percepts *,"University at Buffalo, State University of New York","University at Buffalo, State University of New York","University at Buffalo, State University of New York",,,,,,,,,,,3.0,0.0
2,Relational One-Class Classification: A Non-Parametric Approach,Indiana University,University of Wisconsin–Madison,,,,,,,,,,,,2.0,0.0
3,On Detecting Nearly Structured Preference Profiles,University of Oxford,University of Vienna,,,,,,,,,,,,2.0,0.0
4,Robust Multi-View Spectral Clustering via Low-Rank and Sparse Decomposition,Wuhan University,Nanjing University of Posts and Telecommunications,Wuhan University,Nanjing University of Posts and Telecommunications,Institute of Computing Technology,Nanjing University of Posts and Telecommunications,Nanjing University of Posts and Telecommunications,,,,,,,7.0,0.0
5,A Unified Framework for Augmented Reality and Knowledge-Based Systems in Maintaining Aircraft,Inha University,Inha University,Inha University,Inha University,Inha University,University of Southern California,University of Southern California,,,,,,,7.0,0.0
6,Learning to Recognize Novel Objects in One Shot through Human-Robot Interactions in Natural Language Dialogues,Tufts University,"Inst. for Automation and Control Technical University Vienna Gusshausstr 27-29/E376 1040 Vienna, Austri",Tufts University,Tufts University,,,,,,,,,,3.0,0.0
7,Schedule-Based Robotic Search for Multiple Residents in a Retirement Home Environment,University of Toronto,University of Toronto,University of Toronto,,,,,,,,,,,3.0,0.0
8,Internally Stable Matchings and Exchanges ⇤,Tsinghua University,Tsinghua University,Tsinghua University,,,,,,,,,,,3.0,0.0
9,The Importance of Cognition and Affect for Artificially Intelligent Decision Makers,University of Southern California,University of Southern California,University of Southern California,,,,,,,,,,,3.0,0.0
10,Reputation-Aware Continuous Double Auction,Nanyang Technological University,Nanyang Technological University,Nanyang Technological University,Nanyang Technological University,,,,,,,,,,4.0,0.0
11,Modal Ranking: A Uniquely Robust Voting Rule,University of Patras,Carnegie Mellon University,Carnegie Mellon University,,,,,,,,,,,3.0,0.0
12,Labeling Complicated Objects: Multi-View Multi-Instance Multi-Label Learning ⇤,Nanjing University,Universidad de Ingeniería y Tecnología,Nanjing University,Chinese Academy of Sciences,Nanjing University,,,,,,,,,5.0,0.0
13,Signed Laplacian Embedding for Supervised Dimension Reduction,Shanghai Jiao Tong University,Shanghai Jiao Tong University,Shanghai Jiao Tong University,Shanghai Jiao Tong University,,,,,,,,,,4.0,0.0
14,Pre-Trained Multi-View Word Embedding Using Two-side Neural Network,Peking University,Peking University,Microsoft Research Asia (China),Peking University,Microsoft Research Asia (China),Microsoft Research Asia (China),,,,,,,,3.0,3.0
15,Fast Multi-Instance Multi-Label Learning *,Nanjing University,Nanjing University,Nanjing University,,,,,,,,,,,3.0,0.0
16,A Relevance-Based Compilation Method for Conformant Probabilistic Planning,Ben-Gurion University of the Negev,Ben-Gurion University of the Negev,,,,,,,,,,,,2.0,0.0
17,A Region-Based Model for Estimating Urban Air Pollution,École Polytechnique Fédérale de Lausanne,Australian National University,École Polytechnique Fédérale de Lausanne,,,,,,,,,,,3.0,0.0
18,Two Case Studies for Trading Multiple Indivisible Goods with Indifferences,Kyushu University,Kyushu University,Kyushu University,Kyushu University,,,,,,,,,,4.0,0.0
19,Shallow Blue: Lego-Based Embodied AI as a Platform for Cross-Curricular Project Based Learning,Canisius College,Canisius College,,,,,,,,,,,,2.0,0.0
20,Point-Based POMDP Solving with Factored Value Function Approximation,University of Lisbon,Delft University of Technology,University of Lisbon,,,,,,,,,,,3.0,0.0
21,A Framework for Task Planning in Heterogeneous Multi Robot Systems based on Robot Capabilities,UNSW Sydney,UNSW Sydney,,,,,,,,,,,,2.0,0.0
22,On Dataless Hierarchical Text Classification,University of Illinois Urbana-Champaign,University of Illinois Urbana-Champaign,,,,,,,,,,,,2.0,0.0
23,Optimal and Efficient Stochastic Motion Planning in Partially-Known Environments,Rice University,Rice University,Rice University,Rice University,,,,,,,,,,4.0,0.0
24,Large-Scale Supervised Multimodal Hashing with Semantic Correlation Maximization,Shanghai Jiao Tong University,Nanjing University,,,,,,,,,,,,2.0,0.0
25,Theory of Cooperation in Complex Social Networks,Maastricht University,University of Pennsylvania,Maastricht University,University of Liverpool,University of Liverpool,Maastricht University,,,,,,,,6.0,0.0
26,A Simple Polynomial-Time Randomized Distributed Algorithm for Connected Row Convex Constraints,University of Southern California,Singapore Management University,New Mexico State University,University of Southern California,,,,,,,,,,4.0,0.0
27,Learning with Augmented Class by Exploiting Unlabeled Data ⇤,Nanjing University,Nanjing University,Nanjing University,,,,,,,,,,,3.0,0.0
28,Improving Semi-Supervised Target Alignment via Label-Aware Base Kernels,"Rutgers, The State University of New Jersey"," NEC Laboratories America, Inc. 4 Independence Way, Princeton, NJ 08540 US"," NEC Laboratories America, Inc. 4 Independence Way, Princeton, NJ 08540 US","Rutgers, The State University of New Jersey",,,,,,,,,,2.0,0.0
29,Type-Based Exploration with Multiple Search Queues for Satisficing Planning,University of Alberta,University of Alberta,University of Alberta,Tokyo Institute of Technology,,,,,,,,,,4.0,0.0
30,Identifying Domain-Dependent Influential Microblog Users: A Post-Feature Based Approach,Wuhan University of Technology,Wuhan University of Technology,University of Technology Sydney,Nankai University,,,,,,,,,,4.0,0.0
31,Scheduling for Transfers in Pickup and Delivery Problems with Very Large Neighborhood Search,Carnegie Mellon University,Carnegie Mellon University,,,,,,,,,,,,2.0,0.0
32,Detecting Information-Dense Texts in Multiple News Domains,University of Pennsylvania,University of Pennsylvania,,,,,,,,,,,,2.0,0.0
33,Mechanism Design for Mobile Geo-Location Advertising,Politecnico di Milano,Politecnico di Milano,"Microsoft Research 21 Station Road Cambridge, CB1 2FB, U",University of Southampton,,,,,,,,,,3.0,0.0
34,How Do Your Friends on Social Media Disclose Your Emotions?,Tsinghua University,Tsinghua University,Tsinghua University,Tsinghua University,Tsinghua University,Tsinghua University,Tsinghua University,Tsinghua University,,,,,,8.0,0.0
35,Efficient Buyer Groups for Prediction-of-Use Electricity Tariffs,Heriot-Watt University,University of Southampton,University of Southampton,University of Southampton,,,,,,,,,,4.0,0.0
36,Placement of Loading Stations for Electric Vehicles: No Detours Necessary!,University of Stuttgart,University of Stuttgart,University of Freiburg,,,,,,,,,,,3.0,0.0
37,Using Response Functions to Measure Strategy Strength,University of Alberta,University of Alberta,University of Alberta,,,,,,,,,,,3.0,0.0
38,Potential-Aware Imperfect-Recall Abstraction with Earth Mover's Distance in Imperfect-Information Games,Carnegie Mellon University,Carnegie Mellon University,,,,,,,,,,,,2.0,0.0
39,Collaborative Models for Referring Expression Generation in Situated Dialogue,Michigan State University,Michigan State University,Michigan State University,,,,,,,,,,,3.0,0.0
40,GP-Localize: Persistent Mobile Robot Localization Using Online Sparse Gaussian Process Observation Model,Singapore-MIT Alliance for Research and Technology,Singapore-MIT Alliance for Research and Technology,Singapore-MIT Alliance for Research and Technology,Singapore-MIT Alliance for Research and Technology,National University of Singapore,,,,,,,,,5.0,0.0
41,Learning Word Representation Considering Proximity and Ambiguity,Shanghai Jiao Tong University,Microsoft Research (India),Microsoft Research (India),Microsoft Research (India),Shanghai Jiao Tong University,Microsoft Research (India),,,,,,,,2.0,4.0
42,Reasoning on LTL on Finite Traces: Insensitivity to Infiniteness,Sapienza University of Rome,Sapienza University of Rome,"KRDB Research Centre for Knowledge and Data Free University of Bozen-Bolzano, Ital",,,,,,,,,,,2.0,0.0
43,Sub-Selective Quantization for Large-Scale Image Search,The University of Texas at Arlington,The University of Texas at Arlington,IBM Research - Thomas J. Watson Research Center,The University of Texas at Arlington,,,,,,,,,,4.0,0.0
44,Extending Tournament Solutions,Technical University of Munich,Duke University,University of Oxford,,,,,,,,,,,3.0,0.0
45,Tree-Based On-Line Reinforcement Learning,"Laboratório Nacional de Computac ¸ão Científica Petrópolis, RJ, Brazi","Laboratório Nacional de Computac ¸ão Científica Petrópolis, RJ, Brazi",,,,,,,,,,,,1.0,0.0
46,Learning Parametric Models for Social Infectivity in Multi-Dimensional Hawkes Processes,Georgia Institute of Technology,Georgia Institute of Technology,East China Normal University,,,,,,,,,,,3.0,0.0
47,Simultaneous Cake Cutting,Carnegie Mellon University,Aarhus University,Carnegie Mellon University,Carnegie Mellon University,,,,,,,,,,4.0,0.0
48,Effective Management of Electric Vehicle Storage Using Smart Charging,Erasmus University Rotterdam,Erasmus University Rotterdam,University of Minnesota,University of Connecticut,,,,,,,,,,4.0,0.0
49,Exact Subspace Clustering in Linear Time,Zhejiang University,Zhejiang University,Zhejiang University,Shanghai Jiao Tong University,,,,,,,,,,4.0,0.0
50,Programming by Example using Least General Generalizations,"Microsoft Research Cambridge 21 Station Road, Cambridge, CB1 2FB, U.K",Microsoft (United States),"Microsoft Research Cambridge 21 Station Road, Cambridge, CB1 2FB, U.K",,,,,,,,,,,0.0,1.0
51,"Where and Why Users ""Check In""",Marina Del Rey Hospital,Marina Del Rey Hospital,Marina Del Rey Hospital,,,,,,,,,,,3.0,0.0
52,Identifying Differences in Physician Communication Styles with a Log-Linear Transition Component Model,Brown University,Brown University,Brown University,Brown University,Brown University,Brown University,,,,,,,,6.0,0.0
53,Imitation Learning with Demonstrations and Shaping Rewards,Oregon State University,Oregon State University,Oregon State University,Oregon State University,,,,,,,,,,4.0,0.0
54,Efficiently Implementing GOLOG with Answer Set Programming,UNSW Sydney,,,,,,,,,,,,,1.0,0.0
55,Uncovering Hidden Structure through Parallel Problem Decomposition *,Cornell University,Cornell University,Cornell University,Cornell University,,,,,,,,,,4.0,0.0
56,Non-Linear Label Ranking for Large-Scale Prediction of Long-Term User Interests,Yahoo (United States),Yahoo (United States),Yahoo (United States),Yahoo (United States),Temple University,,,,,,,,,1.0,4.0
57,Finding Median Point-Set Using Earth Mover's Distance *,"University at Buffalo, State University of New York","University at Buffalo, State University of New York",,,,,,,,,,,,2.0,0.0
58,Contraction and Revision over DL-Lite TBoxes,Griffith University,Griffith University,Griffith University,Southeast University,Nanjing University,,,,,,,,,5.0,0.0
59,Capturing Difficulty Expressions in Student Online Q&A Discussions,"Samsung Electronics Suwon, South Kore",National Research University Higher School of Economics,,,,,,,,,,,,1.0,0.0
60,Privacy and Regression Model Preserved Learning,IBM Research - Thomas J. Watson Research Center,IBM Research - Thomas J. Watson Research Center,Michigan State University,,,,,,,,,,,3.0,0.0
61,On the Challenges of Physical Implementations of RBMs,Département d'Informatique,Département d'Informatique,Département d'Informatique,Département d'Informatique,,,,,,,,,,4.0,0.0
62,Encoding Tree Sparsity in Multi-Task Learning: A Probabilistic Framework,Peking University,Hong Kong Baptist University,Hong Kong Baptist University,Peking University,Peking University,,,,,,,,,5.0,0.0
63,Addressing Complexity in Multi-Issue Negotiation via Utility Hypergraphs,Nagoya Institute of Technology,Nagoya Institute of Technology,,,,,,,,,,,,2.0,0.0
64,A Propagator Design Framework for Constraints over Sequences,Uppsala University,Uppsala University,Uppsala University,,,,,,,,,,,3.0,0.0
65,Improving Context and Category Matching for Entity Search,Renmin University of China,Renmin University of China,Renmin University of China,Renmin University of China,,,,,,,,,,4.0,0.0
66,Parallel Restarted Search,Carnegie Mellon University,"Oracle America Inc. Burlington, MA 01803, US",IBM Research - Thomas J. Watson Research Center,,,,,,,,,,,2.0,0.0
67,PAC Rank Elicitation through Adaptive Sampling of Stochastic Pairwise Preferences,MTA-SZTE Research Group on Artificial Intelligence,"INRIA Lille, SequeL project, Franc",Paderborn University,,,,,,,,,,,3.0,0.0
68,Automatically Creating Multilingual Lexical Resources,University of Colorado Colorado Springs,University of Colorado Colorado Springs,,,,,,,,,,,,2.0,0.0
69,Supervised Transfer Sparse Coding,King Abdullah University of Science and Technology,"University at Buffalo, State University of New York",King Abdullah University of Science and Technology,Texas A&M University,King Abdullah University of Science and Technology,,,,,,,,,5.0,0.0
70,MaxSAT by Improved Instance-Specific Algorithm Configuration,University of Lleida,University College Cork,IBM Research - Thomas J. Watson Research Center,,,,,,,,,,,3.0,0.0
71,On Boosting Sparse Parities,University of Illinois at Chicago,,,,,,,,,,,,,1.0,0.0
72,Communication-Restricted Exploration for Small Teams,University of Minnesota,Tohoku Gakuin University,,,,,,,,,,,,2.0,0.0
73,A Data Complexity Approach to Kernel Selection for Support Vector Machines,University of Houston,University of Houston,,,,,,,,,,,,2.0,0.0
74,A Knowledge Compilation Map for Ordered Real-Valued Decision Diagrams,Université Toulouse III - Paul Sabatier,Artois University,Costruzioni Apparecchiature Elettroniche Nucleari (Italy),Université Toulouse III - Paul Sabatier,Artois University,,,,,,,,,4.0,0.0
75,User Group Oriented Temporal Dynamics Exploration,Peking University,"University of California, Santa Barbara",Peking University,,,,,,,,,,,3.0,0.0
76,Learning Latent Engagement Patterns of Students in Online Courses,"University of Maryland, College Park","University of Maryland, College Park","University of Maryland, College Park","University of Maryland, College Park","University of California, Santa Cruz",,,,,,,,,5.0,0.0
77,Convex Co-Embedding,Alberta Hospital Edmonton,Temple University,Alberta Hospital Edmonton,,,,,,,,,,,3.0,0.0
78,Simpler Bounded Suboptimal Search,University of New Hampshire,University of New Hampshire,,,,,,,,,,,,2.0,0.0
79,Computing General First-Order Parallel and Prioritized Circumscription,Sun Yat-sen University,Sun Yat-sen University,Sun Yat-sen University,Western Sydney University,Western Sydney University,,,,,,,,,5.0,0.0
80,Sparse Learning for Stochastic Composite Optimization,Zhejiang University,Michigan State University,Zhejiang University,Michigan State University,Zhejiang University,Zhejiang University,,,,,,,,6.0,0.0
81,Generalized Higher-Order Tensor Decomposition via Parallel ADMM," Department of Computer Science and Engineering, The Chinese University o",Chinese University of Hong Kong," Department of Computer Science and Engineering, The Chinese University o",,,,,,,,,,,1.0,0.0
82,Optimal Neighborhood Preserving Visualization by Maximum Satisfiability *,Aalto University,University of Helsinki,University of Helsinki,University of Helsinki,University of Tampere,Aalto University,Aalto University,University of Helsinki,,,,,,7.0,0.0
83,Low-Rank Tensor Learning with Discriminant Analysis for Action Classification and Image Recovery *,Electrical and Computer Engineering Department Heads Association,Ocean University of China,Electrical and Computer Engineering Department Heads Association,Northeastern University,,,,,,,,,,4.0,0.0
84,Fraudulent Support Telephone Number Identification Based on Co-occurrence Information on the Web,Tsinghua University,Tsinghua University,Tsinghua University,Tsinghua University,,,,,,,,,,4.0,0.0
85,Maximum Satisfiability Using Core-Guided MAXSAT Resolution,University of Toronto,University of Toronto,,,,,,,,,,,,2.0,0.0
86,Avoiding Plagiarism in Markov Sequence Generation,Sony Computer Science Laboratories,Sorbonne University,Sony Computer Science Laboratories,Sorbonne University,,,,,,,,,,4.0,0.0
87,"Leveraging Fee-Based, Imperfect Advisors in Human-Agent Games of Trust","University of Maryland, College Park",Bar-Ilan University,Bar-Ilan University,,,,,,,,,,,3.0,0.0
88,Mixing-Time Regularized Policy Gradient,IBM Research - Tokyo,IBM Research - Tokyo,Kyushu University,,,,,,,,,,,3.0,0.0
89,Robust Winners and Winner Determination Policies Under Candidate Uncertainty,Computer Science Department,Paris Dauphine University,Computer Science Department,Departament de Tecnologies Universitat Pompeu Fabr,,,,,,,,,,4.0,0.0
90,Bagging by Design (on the Suboptimality of Bagging),"IIIS, Tsinghua Universit","IIIS, Tsinghua Universit","IIIS, Tsinghua Universit",,,,,,,,,,,3.0,0.0
91,Tailoring Local Search for Partial MaxSAT,Institute of Software,National Institute of Information and Communications Technology,Peking University,Griffith University,Griffith University,,,,,,,,,5.0,0.0
92,Adaptive Singleton-Based Consistencies *,French National Centre for Scientific Research,French National Centre for Scientific Research,French National Centre for Scientific Research,,,,,,,,,,,3.0,0.0
93,Latent Low-Rank Transfer Subspace Learning for Missing Modality Recognition *,Northeastern University,Northeastern University,Northeastern University,,,,,,,,,,,3.0,0.0
94,Generalized Label Reduction for Merge-and-Shrink Heuristics,University of Basel,University of Basel,University of Basel,,,,,,,,,,,3.0,0.0
95,Online Portfolio Selection with Group Sparsity,University of Minnesota,University of Minnesota,University of Minnesota,,,,,,,,,,,3.0,0.0
96,Pathway Specification and Comparative Queries: A High Level Language with Petri Net Semantics,Arizona State University,Arizona State University,,,,,,,,,,,,2.0,0.0
97,"Parallel Materialisation of Datalog Programs in Centralised, Main-Memory RDF Systems",University of Oxford,University of Oxford,University of Oxford,University of Oxford,University of Oxford,,,,,,,,,5.0,0.0
98,How Long Will It Take? Accurate Prediction of Ontology Reasoning Performance,Monash University,University of Aberdeen,"Inst. for Infocomm Research, Singapor",Monash University,Monash University,,,,,,,,,5.0,0.0
99,Leveraging Decomposed Trust in Probabilistic Matrix Factorization for Effective Recommendation,Nanyang Technological University,Nanyang Technological University,,,,,,,,,,,,2.0,0.0
100,Reinforcement Learning on Multiple Correlated Signals,Vrije Universiteit Brussel,Vrije Universiteit Brussel,,,,,,,,,,,,2.0,0.0
101,Acquiring Commonsense Knowledge for Sentiment Analysis through Human Computation,École Polytechnique Fédérale de Lausanne,École Polytechnique Fédérale de Lausanne,École Polytechnique Fédérale de Lausanne,,,,,,,,,,,3.0,0.0
102,Adaptation-Guided Case Base Maintenance,Indiana University,Indiana University,,,,,,,,,,,,2.0,0.0
103,Elementary Loops Revisited,University of Science and Technology of China,Sun Yat-sen University,Sun Yat-sen University,Sun Yat-sen University,Sun Yat-sen University,,,,,,,,,5.0,0.0
104,Deep Modeling of Group Preferences for Group-Based Recommendation,Shanghai Jiao Tong University,University of Technology Sydney,Shanghai Jiao Tong University,University of Technology Sydney,University of Technology Sydney,Shanghai Technical Institute of Electronics & Information,University of Technology Sydney,,,,,,,7.0,0.0
105,Solving the Inferential Frame Problem in the General Game Description Language,University of Potsdam,UNSW Sydney,UNSW Sydney,,,,,,,,,,,3.0,0.0
106,Pattern Discovery in Protein Networks Reveals High-Confidence Predictions of Novel Interactions,Queen's University,Queen's University,,,,,,,,,,,,2.0,0.0
107,SenticNet 3: A Common and Common-Sense Knowledge Base for Cognition-Driven Sentiment Analysis,Nanyang Technological University,Carnegie Mellon University,National University of Singapore,,,,,,,,,,,3.0,0.0
108,Manifold Spanning Graphs,University of Massachusetts Amherst,University of Massachusetts Amherst,,,,,,,,,,,,2.0,0.0
109,Online and Stochastic Learning with a Human Cognitive Bias,The University of Tokyo,The University of Tokyo,,,,,,,,,,,,2.0,0.0
110,PREGO: An Action Language for Belief-Based Cognitive Robotics in Continuous Domains *,University of Toronto,University of Toronto,,,,,,,,,,,,2.0,0.0
111,TopicMF: Simultaneously Exploiting Ratings and Reviews for Recommendation,Nanyang Technological University,Nanyang Technological University,,,,,,,,,,,,2.0,0.0
112,Modeling Argumentation and Explanation in the Social Web,Western University,,,,,,,,,,,,,1.0,0.0
113,Signals in the Silence: Models of Implicit Feedback in a Recommendation System for Crowdsourcing,"Department of Computer Science and Engineering University of Washington Seattle, WA 9819",Microsoft (United States),,,,,,,,,,,,1.0,2.0
114,CORECLUSTER: A Degeneracy Based Graph Clustering Framework,French National Centre for Scientific Research,French National Centre for Scientific Research,French National Centre for Scientific Research,French National Centre for Scientific Research,,,,,,,,,,4.0,0.0
115,Learning Temporal Dynamics of Behavior Propagation in Social Networks *,Tsinghua University,Tsinghua University,,,,,,,,,,,,2.0,0.0
116,Capturing Relational Schemas and Functional Dependencies in RDFS,Free University of Bozen-Bolzano,"Institute of Information Systems Vienna Univ. of Technology, Austri","Institute of Information Systems Vienna Univ. of Technology, Austri","Institute of Information Systems Vienna Univ. of Technology, Austri","Institute of Information Systems Vienna Univ. of Technology, Austri",,,,,,,,,5.0,0.0
117,Doubly Regularized Portfolio with Risk Minimization,Columbia University,IBM Research - Thomas J. Watson Research Center,Chinese University of Hong Kong,,,,,,,,,,,3.0,0.0
118,Automatic Construction and Natural-Language Description of Nonparametric Regression Models,Department of Engineering University of Cambridg,Department of Engineering University of Cambridg,Institute of Cognitive and Brain Sciences,Institute of Cognitive and Brain Sciences,Department of Engineering University of Cambridg,,,,,,,,,2.0,0.0
119,Solving Uncertain MDPs by Reusing State Information and Plans,New Mexico State University,New Mexico State University,New Mexico State University,,,,,,,,,,,3.0,0.0
120,Non-Restarting SAT Solvers with Simple Preprocessing Can Efficiently Simulate Resolution,University of Washington,IBM Research - Thomas J. Watson Research Center,,,,,,,,,,,,2.0,0.0
121,Improving Domain-Independent Cloud-Based Speech Recognition with Domain-Dependent Phonetic Post-Processing,Universität Hamburg,Universität Hamburg,Universität Hamburg,Universität Hamburg,,,,,,,,,,4.0,0.0
122,Constructing Symbolic Representations for High-Level Planning,"MIT Computer Science and Artificial Intelligence Laboratory 32 Vassar Street, Cambridge MA 02139 US","MIT Computer Science and Artificial Intelligence Laboratory 32 Vassar Street, Cambridge MA 02139 US","MIT Computer Science and Artificial Intelligence Laboratory 32 Vassar Street, Cambridge MA 02139 US",,,,,,,,,,,3.0,0.0
123,Generating Content for Scenario-Based Serious-Games Using CrowdSourcing,"University of California, Irvine","University of California, Irvine","University of California, Irvine","University of California, Irvine","University of California, Irvine",,,,,,,,,5.0,0.0
124,Jim: A Platform for Affective AI in an Interdisciplinary Setting,Canisius College,University of Rochester,Canisius College,,,,,,,,,,,3.0,0.0
125,Regret Transfer and Parameter Optimization,Carnegie Mellon University,Carnegie Mellon University,,,,,,,,,,,,2.0,0.0
126,Diagnosing Analogue Linear Systems Using Dynamic Topological Reconfiguration,"General Diagnostics Burgwal 47 2611GG, Delft, The Netherland",University College Cork,,,,,,,,,,,,1.0,1.0
127,Linear-Time Filtering Algorithms for the Disjunctive Constraint,Université Laval,Université Laval,,,,,,,,,,,,2.0,0.0
128,Accurate Integration of Aerosol Predictions by Smoothing on a Manifold,Hong Kong University of Science and Technology,Hong Kong University of Science and Technology,Hong Kong University of Science and Technology,,,,,,,,,,,3.0,0.0
129,Context-ware Collaborative Topic Regression with Social Matrix Factorization for Recommender Systems,Zhejiang University,Zhejiang University,Macquarie University,Zhejiang University,Zhejiang University,,,,,,,,,5.0,0.0
130,Identifying Hierarchies for Fast Optimal Search,University of Southern California,University of Southern California,,,,,,,,,,,,2.0,0.0
131,Evaluating Trauma Patients: Addressing Missing Covariates with Joint Optimization,University of Michigan–Ann Arbor,University of Michigan–Ann Arbor,Henry Ford Hospital,University of Michigan–Ann Arbor,,,,,,,,,,4.0,0.0
132,The Role of Dimensionality Reduction in Classification,"University of California, Merced","University of California, Merced",,,,,,,,,,,,2.0,0.0
133,Local-to-Global Consistency Implies Tractability of Abduction,Linköping University,,,,,,,,,,,,,1.0,0.0
134,Efficient Generalized Fused Lasso and Its Application to the Diagnosis of Alzheimer's Disease,Peking University,Osaka University,Peking University,Osaka University,Peking University,Osaka University,,,,,,,,6.0,0.0
135,Elimination Ordering in Lifted First-Order Probabilistic Inference,University of British Columbia,University of British Columbia,,,,,,,,,,,,2.0,0.0
