Unnamed: 0,title,inst1,inst2,inst3,inst4,inst5,inst6,inst7,inst8,inst9,inst10,inst11,inst12,inst13,inst14,inst15,num_academia,num_company
269,An Image Analysis Environment for Species Identification of Food Contaminating Beetles,Arizona State University,United States Food and Drug Administration,National Center for Toxicological Research,United States Food and Drug Administration,United States Food and Drug Administration,United States Food and Drug Administration,The University of Texas at Austin,National Center for Toxicological Research,National Center for Toxicological Research,National Center for Toxicological Research,,,,,,10.0,0.0
270,Recommendation with Social Dimensions, Yahoo Labs,Arizona State University,Texas A&M University, Yahoo Labs, Yahoo Labs,Arizona State University,Nanning Normal University,,,,,,,,,4.0,0.0
271,Efficient Spatio-Temporal Tactile Object Recognition with Randomized Tiling Convolutional Networks in a Hierarchical Fusion Strategy,University of Computer Studies Yangon,Tsinghua University,University of Melbourne,University of Melbourne,University of Computer Studies Yangon,Tsinghua University,University of Computer Studies Yangon,Tsinghua University,University of Computer Studies Yangon,Tsinghua University,University of Melbourne,,,,,11.0,0.0
272,News Verification by Exploiting Conflicting Social Viewpoints in Microblogs,Institute of Computing Technology,University of Chinese Academy of Sciences,Institute of Computing Technology,Institute of Computing Technology,University of Rochester,,,,,,,,,,,5.0,0.0
273,On the Performance of GoogLeNet and AlexNet Applied to Sketches,Universidade Federal de Pelotas,Universidade Federal de Pelotas,,,,,,,,,,,,,,2.0,0.0
274,Consensus Style Centralizing Auto-Encoder for Weak Style Classification,Northeastern University,Northeastern University,Northeastern University,Northeastern University,Northeastern University,,,,,,,,,,,5.0,0.0
275,Recognizing Complex Activities by a Probabilistic Interval-Based Model,National University of Singapore,National University of Singapore,Bioinformatics Institute,National University of Singapore,National University of Singapore,National University of Singapore,,,,,,,,,,6.0,0.0
276,MUST-CNN: A Multilayer Shift-and-Stitch Deep Convolutional,University of Virginia Medical Center,University of Virginia Medical Center,University of Virginia Medical Center,,,,,,,,,,,,,3.0,0.0
277,Wikipedia in the Tourism Industry: Forecasting Demand and Modeling Usage Behavior,Virginia Tech,Virginia Tech,,,,,,,,,,,,,,2.0,0.0
278,Energy-and Cost-Efficient Pumping Station Control,Informatics Institute University of Amsterda,University of Liverpool,Centrum Wiskunde & Informatica,Nelen & Schuurman,Nelen & Schuurman,HH Hollands Noorderkwartie,,,,,,,,,,6.0,0.0
279,SPAN: Understanding a Question with Its Support Answers,CAS Key Laboratory of Network Data Science and Technology,Chinese Academy of Sciences,,,,,,,,,,,,,,5.0,0.0
280,Viral Clustering: A Robust Method to Extract Structures in Heterogeneous Datasets,Royal Institute of Technology,Royal Institute of Technology,,,,,,,,,,,,,,2.0,0.0
281,Unsupervised Feature Selection by Heuristic Search with Provable Bounds on Suboptimality,The University of Texas at Dallas,The University of Texas at Dallas,The University of Texas at Dallas,The University of Texas at Dallas,,,,,,,,,,,,4.0,0.0
282,Who Can Win a Single-Elimination Tournament?,Stanford University,Stanford University,Stanford University,,,,,,,,,,,,,3.0,0.0
283,Incremental Stochastic Factorization for Online Reinforcement Learning,"Laboratório Nacional de Computac ¸ão Científica Petrópolis, RJ, Brazi","Laboratório Nacional de Computac ¸ão Científica Petrópolis, RJ, Brazi",McGill University,McGill University,,,,,,,,,,,,4.0,0.0
284,Ad Auctions and Cascade Model: GSP Inefficiency and Algorithms,Politecnico di Milano,Politecnico di Milano,,,,,,,,,,,,,,2.0,0.0
285,Noisy Submodular Maximization via Adaptive Sampling with Applications to Crowdsourced Image Collection Summarization,ETH Zurich,ETH Zurich,ETH Zurich,,,,,,,,,,,,,3.0,0.0
286,On Parameter Tying by Quantization,University of North Texas at Dallas,University of North Texas at Dallas,University of North Texas at Dallas,University of North Texas at Dallas,,,,,,,,,,,,4.0,0.0
287,An Autonomous Override System to Prevent Airborne Loss of Control,University of Michigan–Ann Arbor,University of Michigan–Ann Arbor,,,,,,,,,,,,,,2.0,0.0
288,An Algorithmic Framework for Strategic Fair Division,"University of California, Berkeley",University of Patras,Carnegie Mellon University,Carnegie Mellon University,,,,,,,,,,,,4.0,0.0
289,Scalable Sequential Spectral Clustering,The University of Texas at Arlington,The University of Texas at Arlington," Didi Research, Bejing, Chin",,,,,,,,,,,,,2.0,1.0
290,Learning by Transferring from Unsupervised Universal Sources,Carnegie Mellon University,Carnegie Mellon University,,,,,,,,,,,,,,2.0,0.0
291,Are Elephants Bigger than Butterflies? Reasoning about Sizes of Objects,University of Washington,University of Washington,University of Washington,University of Washington,Allen Institute,,,,,,,,,,,5.0,0.0
292,Multi-Instance Multi-Label Class Discovery: A Computational Approach for Assessing Bird Biodiversity,Meta (United States),Oregon State University,Oregon State University,Oregon State University,,,,,,,,,,,,3.0,1.0
293,MOOCs Meet Measurement Theory: A Topic-Modelling Approach,University of Melbourne,University of Melbourne,University of Melbourne,University of Melbourne,RMIT University,,,,,,,,,,,5.0,0.0
294,Understanding Dominant Factors for Precipitation over the Great Lakes Region,Computer Science Department,University of Minnesota,Computer Science Department,Computer Science Department,,,,,,,,,,,,1.0,0.0
295,Dynamic Concept Composition for Zero-Example Event Detection,University of Technology,University of Technology,University of Technology,University of Technology,Carnegie Mellon University,,,,,,,,,,,5.0,0.0
296,A Deep Choice Model,"CREST, JST 4-1-8 Honcho, Kawaguchi, Saitama 332-0012, Japa",IBM Research - Tokyo,,,,,,,,,,,,,,1.0,0.0
297,A Proximal Alternating Direction Method for Semi-Definite Rank Minimization,King Abdullah University of Science and Technology,King Abdullah University of Science and Technology,,,,,,,,,,,,,,2.0,0.0
298,IRobot: Teaching the Basics of Artificial Intelligence in High Schools,"Institute for eHealth Graz University of Applied Sciences Eggenberger Allee 11, 8020 Graz, Austri",Graz University of Technology,"Inffeldgasse 16b/II, 8010 Graz, Austri",Graz University of Technology,"Inffeldgasse 16b/II, 8010 Graz, Austri",,,,,,,,,,,3.0,0.0
299,Document Type Classification in Online Digital Libraries,University of North Texas,Pennsylvania State University,Institute for Infocomm Research,Pennsylvania State University,,,,,,,,,,,,4.0,0.0
300,"College Towns, Vacation Spots, and Tech Hubs: Using Geo-Social Media to Model and Compare Locations",Texas A&M University,Texas A&M University,,,,,,,,,,,,,,2.0,0.0
301,Computing Contingent Plans Using Online Replanning,"Information Systems Engineering Ben Gurion University, Israe","Information Systems Engineering Ben Gurion University, Israe",,,,,,,,,,,,,,2.0,0.0
302,BBookX: Building Online Open Books for Personalized Learning,Association for Information Science and Technology,"Laboratoire des Sciences de l'Ingénieur, de l'Informatique et de l'Imagerie","Laboratoire des Sciences de l'Ingénieur, de l'Informatique et de l'Imagerie",Association for Information Science and Technology," Teaching and Learning with Technology The Pennsylvania State University, University Park, PA 16802 {cul226,sxw327,zzw109,kwilliams,bkp10,bjb40,sps20,hrw115"," Teaching and Learning with Technology The Pennsylvania State University, University Park, PA 16802 {cul226,sxw327,zzw109,kwilliams,bkp10,bjb40,sps20,hrw115"," Teaching and Learning with Technology The Pennsylvania State University, University Park, PA 16802 {cul226,sxw327,zzw109,kwilliams,bkp10,bjb40,sps20,hrw115"," Teaching and Learning with Technology The Pennsylvania State University, University Park, PA 16802 {cul226,sxw327,zzw109,kwilliams,bkp10,bjb40,sps20,hrw115"," Teaching and Learning with Technology The Pennsylvania State University, University Park, PA 16802 {cul226,sxw327,zzw109,kwilliams,bkp10,bjb40,sps20,hrw115",Association for Information Science and Technology,"Laboratoire des Sciences de l'Ingénieur, de l'Informatique et de l'Imagerie",,,,,6.0,0.0
303,A Proactive Sampling Approach to Project Scheduling under Uncertainty,Singapore Management University,Singapore Management University,Singapore Management University,,,,,,,,,,,,,3.0,0.0
304,A.I. as an Introduction to Research Methods in Computer Science,Davidson College,,,,,,,,,,,,,,,1.0,0.0
305,Near-Optimal Active Learning of Multi-Output Gaussian Processes,National University of Singapore,Interactive Media Institute,,,,,,,,,,,,,,2.0,0.0
306,Authorship Attribution Using a Neural Network Language Model,Purdue University West Lafayette,Purdue University West Lafayette,Purdue University West Lafayette,,,,,,,,,,,,,3.0,0.0
307,A Comparison of Supervised Learning Algorithms for Telerobotic Control Using Electromyography Signals,Wentworth Institute of Technology,Wentworth Institute of Technology,Wentworth Institute of Technology,Wentworth Institute of Technology,Wentworth Institute of Technology,Northeastern University,,,,,,,,,,6.0,0.0
308,On the Complexity of mCP-nets,University of Oxford,University of Oxford,,,,,,,,,,,,,,2.0,0.0
309,Online Spatio-Temporal Matching in Stochastic and Dynamic Domains,Massachusetts Institute of Technology,Singapore Management University,,,,,,,,,,,,,,2.0,0.0
310,Assumed Density Filtering Methods for Learning Bayesian Neural Networks,Walt Disney (United States),Walt Disney (United States),Walt Disney (United States),,,,,,,,,,,,,0.0,3.0
311,Topical Analysis of Interactions Between News and Social Media," Department of Computer Science, Virginia Tech Falls Church, VA 2204","University at Albany, State University of New York"," Department of Computer Science, Virginia Tech Falls Church, VA 2204","University at Albany, State University of New York"," Department of Computer Science, Virginia Tech Falls Church, VA 2204","University at Albany, State University of New York"," Department of Computer Science, Virginia Tech Falls Church, VA 2204","University at Albany, State University of New York",,,,,,,,5.0,0.0
312,Marginalized Continuous Time Bayesian Networks for Network Reconstruction from Incomplete Observations,IBM Research - Zurich,LRI UMR CNRS 8623 Université Paris-Sacla,ETH Zurich,IBM Research - Zurich,IBM Research - Zurich,Technical University of Darmstadt,,,,,,,,,,5.0,0.0
313,Structured Features in Naive Bayes Classification,California State University Los Angeles,Sharif University of Technology,California State University Los Angeles,,,,,,,,,,,,,3.0,0.0
314,Discriminative Nonparametric Latent Feature Relational Models with Data Augmentation," Dept. of Comp. Sci. & Tech., State Key Lab of Intell. Tech. & Sys., Center for Bio-Inspired Computing Research, ‡ MOE Key lab of Bioinformatics, Bioinformatics Division and Center for Synthetic & Systems Biology",Tsinghua University," Dept. of Comp. Sci. & Tech., State Key Lab of Intell. Tech. & Sys., Center for Bio-Inspired Computing Research, ‡ MOE Key lab of Bioinformatics, Bioinformatics Division and Center for Synthetic & Systems Biology",Tsinghua University," Dept. of Comp. Sci. & Tech., State Key Lab of Intell. Tech. & Sys., Center for Bio-Inspired Computing Research, ‡ MOE Key lab of Bioinformatics, Bioinformatics Division and Center for Synthetic & Systems Biology",Tsinghua University," Dept. of Comp. Sci. & Tech., State Key Lab of Intell. Tech. & Sys., Center for Bio-Inspired Computing Research, ‡ MOE Key lab of Bioinformatics, Bioinformatics Division and Center for Synthetic & Systems Biology",Tsinghua University,,,,,,,,1.0,4.0
315,Personalized Alert Agent for Optimal User Performance,Bar-Ilan University,Carnegie Mellon University,Bar-Ilan University," General Motors Advanced Technical Center, Herzliya 46725, Israe",Tel Aviv University," General Motors Advanced Technical Center, Herzliya 46725, Israe",,,,,,,,,,4.0,2.0
316,Tiebreaking Strategies for A* Search: How to Explore the Final Frontier,Graduate School of Arts and Sciences The University of Toky,Graduate School of Arts and Sciences The University of Toky,,,,,,,,,,,,,,2.0,0.0
317,Reinforcement Learning with Parameterized Actions,University of the Witwatersrand,University of the Witwatersrand,"Department of Computer Science Duke University Durham, North Carolina 2770",,,,,,,,,,,,,2.0,0.0
318,Holographic Embeddings of Knowledge Graphs,Massachusetts Institute of Technology,Italian Institute of Technology,Massachusetts Institute of Technology,Italian Institute of Technology,University of Genoa,Massachusetts Institute of Technology,,,,,,,,,,6.0,0.0
319,Improving Opinion Aspect Extraction Using Semantic Similarity and Aspect Associations," Key Lab of Computer Network and Information Integration (Southeast University), Ministry of Education, Chin",Southeast University,University of Illinois at Chicago,Texas Tech University,Robert Bosch (United States)," Key Lab of Computer Network and Information Integration (Southeast University), Ministry of Education, Chin",Southeast University,,,,,,,,,4.0,1.0
320,"ExTaSem! Extending, Taxonomizing and Semantifying Domain Terminologies",Pompeu Fabra University,Pompeu Fabra University,Pompeu Fabra University,Sapienza University of Rome,,,,,,,,,,,,4.0,0.0
321,Active Learning with Cross-Class Knowledge Transfer,Tsinghua University,Tsinghua University,Tsinghua University,Tsinghua University,,,,,,,,,,,,4.0,0.0
322,Selecting Near-Optimal Learners via Incremental Data Allocation,Allen Institute for Artificial Intelligence,IBM Research - Thomas J. Watson Research Center,IBM Research - Thomas J. Watson Research Center,,,,,,,,,,,,,3.0,0.0
323,Shortest Path Based Decision Making Using Probabilistic Inference,Singapore Management University,,,,,,,,,,,,,,,1.0,0.0
324,Rules for Choosing Societal Tradeoffs,Duke University,Duke University,Duke University,Duke University,,,,,,,,,,,,4.0,0.0
325,What's Hot in Intelligent User Interfaces,"University of Maryland, Baltimore",San Jose State University,University of British Columbia,Georgia Institute of Technology,Georgia Institute of Technology,University of Cambridge,University of Cambridge,,,,,,,,,7.0,0.0
326,Fusing Social Networks with Deep Learning for Volunteerism Tendency Prediction,National University of Singapore,National University of Singapore,National University of Singapore,Baidu (China),National University of Singapore,National University of Singapore,National University of Singapore,,,,,,,,,6.0,1.0
327,Building a Large Scale Dataset for Image Emotion Recognition: The Fine Print and the Benchmark,University of Rochester,University of Rochester,"Adobe Research 345 Park Avenue San Jose, CA 9511",Snap (United States),,,,,,,,,,,,2.0,1.0
328,Randomised Procedures for Initialising and Switching Actions in Policy Iteration,Indian Institute of Technology Bombay,Indian Institute of Technology Gandhinagar,Indian Institute of Science Bangalore,,,,,,,,,,,,,3.0,0.0
329,Little Is Much: Bridging Cross-Platform Behaviors through Overlapped Crowds,Tsinghua University,Tsinghua University,Microsoft Research Asia (China),Microsoft Research Asia (China),Tsinghua University,,,,,,,,,,,3.0,2.0
330,Exact Sampling with Integer Linear Programs and Random Perturbations,Stanford University,Allen Institute for Artificial Intelligence,Stanford University,,,,,,,,,,,,,3.0,0.0
331,Random Mixed Field Model for Mixed-Attribute Data Restoration,University of Technology Sydney,University of Technology Sydney,University of Technology Sydney,University of Technology Sydney,University of Technology Sydney,University of Technology Sydney,,,,,,,,,,6.0,0.0
332,Temporal Vaccination Games under Resource Constraints," Network Dynamics and Simulation Science Laboratory, Biocomplexity Institute of Virginia Tec"," Network Dynamics and Simulation Science Laboratory, Biocomplexity Institute of Virginia Tec",Virginia Tech,,,,,,,,,,,,,2.0,0.0
333,Nested Monte Carlo Search for Two-Player Games,Paris Dauphine University,UNSW Sydney,UNSW Sydney,UNSW Sydney,,,,,,,,,,,,4.0,0.0
334,Epitomic Image Super-Resolution,University of Illinois Urbana-Champaign,University of Illinois Urbana-Champaign,Adobe Systems (United States),University of Illinois Urbana-Champaign,University of Illinois Urbana-Champaign,University of Illinois Urbana-Champaign,University of Illinois Urbana-Champaign,,,,,,,,,6.0,1.0
335,The Turing Test in the Classroom,St. Lawrence University,St. Lawrence University,St. Lawrence University,St. Lawrence University,St. Lawrence University,,,,,,,,,,,5.0,0.0
336,"Learning for Decentralized Control of Multiagent Systems in Large, Partially-Observable Stochastic Environments",Lerdsin Hospital,University of New Hampshire,Massachusetts Institute of Technology,Massachusetts Institute of Technology,Cambridge–MIT Institute,,,,,,,,,,,3.0,0.0
337,Detect Overlapping Communities via Ranking Node Popularities,Tianjin University,Tianjin University,Tianjin University,Japan Advanced Institute of Science and Technology,Tianjin University,Jianghan University,Washington University in St. Louis,,,,,,,,,7.0,0.0
338,Progressive EM for Latent Tree Models and Hierarchical Topic Detection,Hong Kong University of Science and Technology,Hong Kong University of Science and Technology,Education University of Hong Kong,Hong Kong University of Science and Technology,,,,,,,,,,,,4.0,0.0
339,Capturing Semantic Correlation for Item Recommendation in Tagging Systems,Zhejiang University of Science and Technology,Zhejiang University of Science and Technology,University of Liverpool,Zhejiang University of Science and Technology,Zhejiang University of Science and Technology,,,,,,,,,,,5.0,0.0
340,Markov Argumentation Random Fields,Carnegie Mellon University,University of Aberdeen,Carnegie Mellon University,,,,,,,,,,,,,3.0,0.0
341,The Constrained Laplacian Rank Algorithm for Graph-Based Clustering,The University of Texas at Arlington,The University of Texas at Arlington,"University of California, Berkeley",The University of Texas at Arlington,,,,,,,,,,,,4.0,0.0
342,Group and Graph Joint Sparsity for Linked Data Classification,Fudan University,Fudan University,,,,,,,,,,,,,,2.0,0.0
343,Locally Adaptive Translation for Knowledge Graph Embedding, CAS Key Laboratory of Network Data Science and Technology,University of Chinese Academy of Sciences, CAS Key Laboratory of Network Data Science and Technology,University of Chinese Academy of Sciences,Institute of Information Engineering, CAS Key Laboratory of Network Data Science and Technology,University of Chinese Academy of Sciences, CAS Key Laboratory of Network Data Science and Technology,University of Chinese Academy of Sciences,,,,,,,5.0,0.0
344,Counterfactual Regret Minimization in Sequential Security Games,University of Alberta,University of Alberta,University of Alberta,,,,,,,,,,,,,3.0,0.0
345,Learning Continuous-Time Bayesian Networks in Relational Domains: A Non-Parametric Approach,Indiana University Bloomington,Allen Institute for Artificial Intelligence,TU Dortmund University,Indiana University Bloomington,,,,,,,,,,,,4.0,0.0
346,Semisupervised Autoencoder for Sentiment Analysis,Binghamton University,Binghamton University,,,,,,,,,,,,,,2.0,0.0
347,Extending the Modelling Capacity of Gaussian Conditional Random Fields while Learning Faster,Temple University,Temple University,University of Belgrade,Temple University,,,,,,,,,,,,4.0,0.0
348,Online Cross-Modal Hashing for Web Image Retrieval,Wuhan University of Technology,Singapore Management University,,,,,,,,,,,,,,2.0,0.0
349,Computing Possible and Necessary Equilibrium Actions (and Bipartisan Set Winners),Duke University,Duke University,Duke University,,,,,,,,,,,,,3.0,0.0
350,Discriminative Vanishing Component Analysis,National University of Defense Technology,Northwestern Polytechnical University,University of Technology,,,,,,,,,,,,,3.0,0.0
351,TGSum: Build Tweet Guided Multi-Document Summarization Dataset,Hong Kong Polytechnic University,Hong Kong Polytechnic University,Hong Kong Polytechnic University,Peking University,Microsoft Research Asia (China),Microsoft Research Asia (China),,,,,,,,,,4.0,2.0
352,Collective Supervision of Topic Models for Predicting Surveys with Social Media,Johns Hopkins University,University of Colorado Boulder,Stanford University,Johns Hopkins University,,,,,,,,,,,,4.0,0.0
353,Inverse Reinforcement Learning through Policy Gradient Minimization,Politecnico di Milano,Politecnico di Milano,,,,,,,,,,,,,,2.0,0.0
354,Preferences Single-Peaked on Nice Trees,University of Oxford,University of Oxford,,,,,,,,,,,,,,2.0,0.0
355,Differential Privacy Preservation for Deep Auto-Encoders: An Application of Human Behavior Prediction,University of Oregon,University of North Carolina at Charlotte,University of Arkansas at Fayetteville,University of Oregon,,,,,,,,,,,,4.0,0.0
356,Deep Contextual Networks for Neuronal Structure Segmentation,Chinese University of Hong Kong,Chinese University of Hong Kong,Chinese University of Hong Kong,Shenzhen Institutes of Advanced Technology,,,,,,,,,,,,4.0,0.0
357,Risk Minimization in the Presence of Label Noise *,Nanjing University,Nanjing University,Nanjing University,Nanjing University,,,,,,,,,,,,4.0,0.0
358,A Symbolic SAT-Based Algorithm for Almost-Sure Reachability with Small Strategies in POMDPs *,Institute of Science and Technology Austria,Institute of Science and Technology Austria,Institute of Science and Technology Austria,,,,,,,,,,,,,3.0,0.0
359,Towards Optimal Binary Code Learning via Ordinal Embedding,Xiamen University,Xiamen University,Techniques of Informatics and Microelectronics for Integrated Systems Architecture,Columbia University,Xiamen University,Xiamen University,Techniques of Informatics and Microelectronics for Integrated Systems Architecture,Columbia University,,,,,,,,8.0,0.0
360,Artificial Intelligence for Predictive and Evidence Based Architecture Design *,University of Bremen,University of Bremen,University of Bremen,University of Bremen,University of Bremen,,,,,,,,,,,5.0,0.0
361,A Word Embedding and a Josa Vector for Korean Unsupervised Semantic Role Induction,Hallym University,Hallym University,,,,,,,,,,,,,,2.0,0.0
362,Knowledge Graph Completion with Adaptive Sparse Transfer Matrix,Chinese Academy of Sciences,Chinese Academy of Sciences,Chinese Academy of Sciences,Chinese Academy of Sciences,,,,,,,,,,,,4.0,0.0
363,A Visual Semantic Framework for Innovation Analytics,University of North Carolina at Charlotte,University of Chicago,University of North Carolina at Charlotte,,,,,,,,,,,,,3.0,0.0
364,Closed-Form Gibbs Sampling for Graphical Models with Algebraic Constraints,Australian National University,Oregon State University,Data61,,,,,,,,,,,,,3.0,0.0
365,Tweet Timeline Generation with Determinantal Point Processes,Peking University,Peking University,Peking University,Renmin University of China,Peking University,Peking University," HTC Research, Beijing, Chin",Peking University,Peking University,,,,,,,8.0,0.0
366,Scalable Completion of Nonnegative Matrices with the Separable Structure,University of Technology,University of Technology,University of Technology,,,,,,,,,,,,,3.0,0.0
367,Fast Asynchronous Parallel Stochastic Gradient Descent: A Lock-Free Approach with Convergence Guarantee,Nanjing University,Nanjing University,,,,,,,,,,,,,,2.0,0.0
368,Transfer Learning for Cross-Language Text Categorization through Active Correspondences Construction *,Institute of High Performance Computing,Nanyang Technological University,University of Technology Sydney,Nanyang Technological University,,,,,,,,,,,,4.0,0.0
369,Direct Discriminative Bag Mapping for Multi-Instance Learning,University of Technology Sydney,Florida Atlantic University,University of Technology Sydney,Florida Atlantic University,University of Technology Sydney,Florida Atlantic University,,,,,,,,,,6.0,0.0
370,"Efficient PAC-Optimal Exploration in Concurrent, Continuous State MDPs with Delayed Updates",Laboratory for Information and Decision System,Massachusetts Institute of Technology,"Department of Computer Science Duke University Durham, NC 2770",,,,,,,,,,,,,2.0,0.0
371,Combining Bounding Boxes and JPS to Prune Grid Pathfinding,DigiPen Institute of Technology,University of Denver,,,,,,,,,,,,,,2.0,0.0
372,Complexity of Shift Bribery in Committee Elections,Technical University of Berlin,AGH University of Science and Technology,Technical University of Berlin,Technical University of Berlin,,,,,,,,,,,,4.0,0.0
373,"BeeMo, a Monte Carlo Simulation Agent for Playing Parameterized Poker Squares",MacEwan University,MacEwan University,MacEwan University,,,,,,,,,,,,,3.0,0.0
374,Intelligent Habitat Restoration Under Uncertainty," Optimisation Research Group, NICTA Canberra Research Lab, 7 London Circuit, Canberra, 2601 ACT, Australi",ARC Centre of Excellence for Coral Reef Studies," Optimisation Research Group, NICTA Canberra Research Lab, 7 London Circuit, Canberra, 2601 ACT, Australi"," Optimisation Research Group, NICTA Canberra Research Lab, 7 London Circuit, Canberra, 2601 ACT, Australi",,,,,,,,,,,,4.0,0.0
375,Competition of Distributed and Multiagent Planners (CoDMAP) *,Czech Technical University in Prague,Department of Measurement and Information Systems,Budapest University of Technology and Economics,,,,,,,,,,,,,2.0,0.0
376,From the Lab to the Classroom and Beyond: Extending a Game-Based Research Platform for Teaching AI to Diverse Audiences,University of Southern California,University of Southern California,University of Southern California,University of Southern California,University of Southern California,University of Southern California,University of Southern California,,,,,,,,,7.0,0.0
