Unnamed: 0,title,inst1,inst2,inst3,inst4,inst5,inst6,inst7,inst8,inst9,inst10,inst11,inst12,inst13,num_academia,num_company
136,"A Model Attention and Selection Framework for Estimation of Many Variables, with Applications to Estimating Object States in Large Spatial Environments",Massachusetts Institute of Technology,,,,,,,,,,,,,1.0,0.0
137,Locality Preserving Projection for Domain Adaptation with Multi-Objective Learning,Temple University,Temple University,Temple University,,,,,,,,,,,3.0,0.0
138,Multiagent Metareasoning Through Organizational Design,University of Michigan–Ann Arbor,University of Michigan–Ann Arbor,,,,,,,,,,,,2.0,0.0
139,Evolutionary Dynamics of Q-Learning over the Sequence Form,Politecnico di Milano,Politecnico di Milano,Politecnico di Milano,,,,,,,,,,,3.0,0.0
140,HC-Search for Multi-Label Prediction: An Empirical Study,Oregon State University,Oregon State University,Oregon State University,Oregon State University,Oregon State University,,,,,,,,,5.0,0.0
141,DJAO: A Communication-Constrained DCOP Algorithm that Combines Features of ADOPT and Action-GDL,University of Massachusetts Amherst,University of Massachusetts Amherst,,,,,,,,,,,,2.0,0.0
142,Roles and Teams Hedonic Games,University of Kent,,,,,,,,,,,,,1.0,0.0
143,Learning the Structure of Probabilistic Graphical Models with an Extended Cascading Indian Buffet Process,Université Laval,Université Laval,Université Laval,,,,,,,,,,,3.0,0.0
144,Relaxation Search: A Simple Way of Managing Optional Clauses,University of Toronto,University of Toronto,University of Toronto,Institut National de la Recherche Agronomique,,,,,,,,,,3.0,0.0
145,Robust Bayesian Inverse Reinforcement Learning with Sparse Behavior Noise,Computer Science Department,Carnegie Mellon University,Computer Science Department,Guangzhou HKUST Fok Ying Tung Research Institute,Hong Kong University of Science and Technology,,,,,,,,,3.0,0.0
146,Trust Prediction with Propagation and Similarity Regularization,Macquarie University,Macquarie University,Macquarie University,Macquarie University,Soochow University,,,,,,,,,5.0,0.0
147,Predicting Postoperative Atrial Fibrillation from Independent ECG Components,University of Michigan–Ann Arbor,University of Michigan–Ann Arbor,University of Michigan–Ann Arbor,University of Michigan–Ann Arbor,University of Michigan–Ann Arbor,,,,,,,,,5.0,0.0
148,Inference Graphs: A New Kind of Hybrid Reasoning System *,"University at Buffalo, State University of New York","University at Buffalo, State University of New York",,,,,,,,,,,,2.0,0.0
149,A Tractable Approach to ABox Abduction over Description Logic Ontologies,Guangdong University of Foreign Studies,Griffith University,State Key Laboratory of Computer Science,Chinese Academy of Sciences,,,,,,,,,,3.0,0.0
150,Online Multi-Task Gradient Temporal-Difference Learning,University of Pennsylvania,University of Pennsylvania,University of Pennsylvania,,,,,,,,,,,3.0,0.0
151,Deploying CommunityCommands: A Software Command Recommender System Case Study,"Autodesk Research, Toronto, Canada","Autodesk Research, Toronto, Canada","Autodesk Research, Toronto, Canada","Autodesk Research, Toronto, Canada",,,,,,,,,,4.0,0.0
152,DOROTHY: Enhancing Bidirectional Communication between a 3D Programming Interface and Mobile Robots,Texas Tech University,Texas Tech University,Texas Tech University,Texas Tech University,,,,,,,,,,4.0,0.0
153,Compact Aspect Embedding for Diversified Query Expansions,Université de Montréal,Université de Montréal,Université de Montréal,Université de Montréal,,,,,,,,,,4.0,0.0
154,Monte Carlo Filtering Using Kernel Embedding of Distributions,"The Graduate University for Advanced Studies, SOKENDAI",The Institute of Statistical Mathematics,University College London,,,,,,,,,,,3.0,0.0
155,The Most Uncreative Examinee: A First Step toward Wide Coverage Natural Language Math Problem Solving,National Institute of Informatics,National Institute of Informatics," Fujitsu Laboratories Ltd., Japa",National Institute of Informatics," Fujitsu Laboratories Ltd., Japa",Kyushu University,National Institute of Informatics,,,,,,,2.0,2.0
156,Predictive Models for Determining If and When to Display Online Lead Forms,Wuhan University,Nanjing University of Posts and Telecommunications,Wuhan University,Nanjing University of Posts and Telecommunications,Nanjing University of Posts and Telecommunications,Wuhan University,Nanjing University of Science and Technology,"Propensity Modeling Team Edmunds.com 1620 26th St, 4th Floor Santa Monica, CA 9040","Propensity Modeling Team Edmunds.com 1620 26th St, 4th Floor Santa Monica, CA 9040","Propensity Modeling Team Edmunds.com 1620 26th St, 4th Floor Santa Monica, CA 9040",,,,1.0,0.0
157,Symbolic Domain Predictive Control,University of Freiburg,University of Basel,King's College London,University of Freiburg,,,,,,,,,,4.0,0.0
158,Semantic Clustering of Morphologically Related Chinese Words,"Institute of Linguistics, Academia Sinica",National Chengchi University,National Chengchi University,"Institute of Linguistics, Academia Sinica",National Taiwan University,,,,,,,,,5.0,0.0
159,Accurate Household Occupant Behavior Modeling Based on Data Mining Techniques,National Institute of Informatics,National Institute of Informatics,National Institute of Informatics,Instituto de Engenharia de Sistemas e Computadores Investigação e Desenvolvimento,Osaka University,,,,,,,,,5.0,0.0
160,Oversubscription Planning: Complexity and Compilability,Linköping University,Linköping University,,,,,,,,,,,,2.0,0.0
161,Machine Translation with Real-Time Web Search ⇤,Harbin Institute of Technology,Microsoft Research Asia (China),Shanghai Jiao Tong University,Microsoft Research Asia (China),Microsoft Research Asia (China),,,,,,,,,2.0,3.0
162,Boosting SBDS for Partial Symmetry Breaking in Constraint Programming,Chinese University of Hong Kong,Chinese University of Hong Kong,,,,,,,,,,,,2.0,0.0
163,A Novel Single-DBN Generative Model for Optimizing POMDP Controllers by Probabilistic Inference,University of Waterloo,University of Waterloo,,,,,,,,,,,,2.0,0.0
164,A Spatially Sensitive Kernel to Predict Cognitive Performance from Short-Term Changes in Neural Structure,Computer Science Department,Computer Science Department,University of Wisconsin–Madison,National Academy of Medicine,National Academy of Medicine,National Academy of Medicine,,,,,,,,1.0,0.0
165,Pairwise-Covariance Linear Discriminant Analysis,The University of Texas at Arlington,The University of Texas at Arlington,,,,,,,,,,,,2.0,0.0
166,Joint Morphological Generation and Syntactic Linearization,Academia Sinica,Singapore University of Technology and Design,Northeastern University,Academia Sinica,Dublin City University,Singapore University of Technology and Design,,,,,,,,6.0,0.0
167,Lifting Relational MAP-LPs Using Cluster Signatures,Ben-Gurion University of the Negev,TU Dortmund University,TU Dortmund University,,,,,,,,,,,3.0,0.0
168,Mechanism Design for Scheduling with Uncertain Execution Time *,Duke University,Duke University,,,,,,,,,,,,2.0,0.0
169,Semantic Graph Construction for Weakly-Supervised Image Parsing,Peking University,Peking University,Peking University,,,,,,,,,,,3.0,0.0
170,Efficient Codes for Inverse Dynamics During Walking,The University of Texas at Austin,The University of Texas at Austin,,,,,,,,,,,,2.0,0.0
171,Synthesis of Geometry Proof Problems,Louisiana State University,"Microsoft Research, Redmon",Louisiana State University,,,,,,,,,,,2.0,0.0
172,Rounded Dynamic Programming for Tree-Structured Stochastic Network Design,University of Massachusetts Amherst,University of Massachusetts Amherst,University of Massachusetts Amherst,,,,,,,,,,,3.0,0.0
173,Novel Density-Based Clustering Algorithms for Uncertain Data,Dalian University of Technology,Dalian University of Technology,Dalian University of Technology,Dalian University of Technology,,,,,,,,,,4.0,0.0
174,Item Bidding for Combinatorial Public Projects,Athens University of Economics and Business,Athens University of Economics and Business,,,,,,,,,,,,2.0,0.0
175,Experiments on Visual Information Extraction with the Faces of Wikipedia,Université de Montréal,Université de Montréal,,,,,,,,,,,,2.0,0.0
176,Adding Local Exploration to Greedy Best-First Search in Satisficing Planning,University of Alberta,University of Alberta,University of Alberta,,,,,,,,,,,3.0,0.0
177,Planning as Model Checking in Hybrid Domains,University of Freiburg,King's College London,University of Freiburg,University of Basel,,,,,,,,,,4.0,0.0
178,LSDH: A Hashing Approach for Large-Scale Link Prediction in Microblogs,Institute of Computing Technology,Institute of Computing Technology,Institute of Computing Technology,Institute of Computing Technology,Institute of Computing Technology,Institute of Computing Technology,,,,,,,,6.0,0.0
179,Small-Variance Asymptotics for Dirichlet Process Mixtures of SVMs,Tsinghua University,Tsinghua University,,,,,,,,,,,,2.0,0.0
180,Multilabel Classification with Label Correlations and Missing Labels,Hong Kong University of Science and Technology,Hong Kong University of Science and Technology,Hong Kong University of Science and Technology,,,,,,,,,,,3.0,0.0
181,Structured Possibilistic Planning Using Decision Diagrams,"Onera -The French Aerospace Lab 2 avenue Edouard Belin 31055 Toulouse Cedex 4, Franc","Onera -The French Aerospace Lab 2 avenue Edouard Belin 31055 Toulouse Cedex 4, Franc","Onera -The French Aerospace Lab 2 avenue Edouard Belin 31055 Toulouse Cedex 4, Franc",Université Toulouse III - Paul Sabatier,,,,,,,,,,1.0,0.0
182,Gradient Descent with Proximal Average for Nonconvex and Composite Regularization,Hong Kong University of Science and Technology,Hong Kong University of Science and Technology,Hong Kong University of Science and Technology,Hong Kong University of Science and Technology,,,,,,,,,,4.0,0.0
183,Online (Budgeted) Social Choice,University of Toronto,"Microsoft Research, New England,US",,,,,,,,,,,,1.0,0.0
184,Prediction of Helpful Reviews Using Emotions Extraction,École Polytechnique Fédérale de Lausanne,École Polytechnique Fédérale de Lausanne,,,,,,,,,,,,2.0,0.0
185,Using Model-Based Diagnosis to Improve Software Testing,Ben-Gurion University of the Negev,Ben-Gurion University of the Negev,Ben-Gurion University of the Negev,,,,,,,,,,,3.0,0.0
186,Generalizing Policy Advice with Gaussian Process Bandits for Dynamic Skill Improvement,Massachusetts Institute of Technology,Massachusetts Institute of Technology,,,,,,,,,,,,2.0,0.0
187,Fused Feature Representation Discovery for High-Dimensional and Sparse Data,National Taitung University,National Taitung University,,,,,,,,,,,,2.0,0.0
188,Biased Games,University of Patras,Carnegie Mellon University,Carnegie Mellon University,,,,,,,,,,,3.0,0.0
189,Strategyproof Exchange with Multiple Private Endowments,Kyushu University,Kyushu University,Kyushu University,,,,,,,,,,,3.0,0.0
190,TacTex'13: A Champion Adaptive Power Trading Agent,The University of Texas at Austin,The University of Texas at Austin,,,,,,,,,,,,2.0,0.0
191,Spatial Scan for Disease Mapping on a Mobile Population,Temple University,University of Novi Sad,Temple University,,,,,,,,,,,3.0,0.0
192,Lifetime Lexical Variation in Social Media,Beijing Institute of Technology,Singapore Management University,Singapore Management University,Beijing Institute of Technology,Singapore Management University,,,,,,,,,5.0,0.0
193,Envy-Free Division of Sellable Goods,Carnegie Mellon University,Carnegie Mellon University,Carnegie Mellon University,,,,,,,,,,,3.0,0.0
194,Forecasting Potential Diabetes Complications,Tsinghua University,KU Leuven,Northwestern University,KU Leuven,Tsinghua University,Tsinghua University,,,,,,,,6.0,0.0
195,StrokeBank: Automating Personalized Chinese Handwriting Generation,Stanford University,Stanford University,,,,,,,,,,,,2.0,0.0
196,Optimal Decomposition in Linear Constraint Systems,Delft University of Technology,Delft University of Technology,Delft University of Technology,,,,,,,,,,,3.0,0.0
197,Online Classification Using a Voted RDA Method,"University of California, Irvine",Microsoft (United States),Microsoft (United States),"University of California, Irvine",,,,,,,,,,2.0,2.0
198,Multi-Instance Learning with Distribution Change ⇤,Nanjing University,Nanjing University,,,,,,,,,,,,2.0,0.0
199,ReLISH: Reliable Label Inference via Smoothness Hypothesis,Shanghai Jiao Tong University,Shanghai Jiao Tong University,Shanghai Jiao Tong University,Shanghai Jiao Tong University,,,,,,,,,,4.0,0.0
200,A Schedule Optimization Tool for Destructive and Non-Destructive Vehicle Tests,Stottler Henke Associates (United States),Stottler Henke Associates (United States),Stottler Henke Associates (United States),Stottler Henke Associates (United States),Stottler Henke Associates (United States),Stottler Henke Associates (United States),Stottler Henke Associates (United States),Stottler Henke Associates (United States),Stottler Henke Associates (United States),Stottler Henke Associates (United States),,,,0.0,10.0
201,Combining Multiple Correlated Reward and Shaping Signals by Measuring Confidence,Vrije Universiteit Brussel,Vrije Universiteit Brussel,University of York,Washington State University,,,,,,,,,,4.0,0.0
202,Solving Imperfect Information Games Using Decomposition,University of Alberta,University of Alberta,University of Alberta,,,,,,,,,,,3.0,0.0
203,Qualitative Planning with Quantitative Constraints for Online Learning of Robotic Behaviours,UNSW Sydney,UNSW Sydney,University of Ljubljana,,,,,,,,,,,3.0,0.0
204,Unsupervised Alignment of Natural Language Instructions with Video Segments,University of Rochester,University of Rochester,University of Rochester,University of Rochester,University of Rochester,University of Rochester,,,,,,,,6.0,0.0
205,An Adversarial Interpretation of Information-Theoretic Bounded Rationality,University of Pennsylvania,University of Pennsylvania,,,,,,,,,,,,2.0,0.0
206,Robust Visual Robot Localization Across Seasons Using Network Flows,University of Freiburg,University of Freiburg,University of Freiburg,University of Bonn,,,,,,,,,,4.0,0.0
207,Optimizing a Start-Stop Controller Using Policy Search," Vehicle Controls, Research & Advanced Engineerin",Massachusetts Institute of Technology,Massachusetts Institute of Technology,Massachusetts Institute of Technology," Vehicle Controls, Research & Advanced Engineerin"," Vehicle Controls, Research & Advanced Engineerin",Computer Science and Artificial Intelligence Laborator,,,,,,,3.0,3.0
208,Equilibria in Epidemic Containment Games,Virginia Tech,Virginia Tech,Virginia Tech,Virginia Tech,,,,,,,,,,4.0,0.0
209,Contextually Supervised Source Separation with Application to Energy Disaggregation,Carnegie Mellon University,Carnegie Mellon University,,,,,,,,,,,,2.0,0.0
210,Deep Salience: Visual Salience Modeling via Deep Belief Propagation,Automatic Control and System Engineerin,University of Sheffield,Queen's University Belfast,,,,,,,,,,,1.0,1.0
211,Locality-Constrained Low-Rank Coding for Image Classification,Beijing Institute of Technology,National University of Defense Technology,Beijing Institute of Technology,National University of Defense Technology,,,,,,,,,,4.0,0.0
212,Dynamic Bayesian Probabilistic Matrix Factorization,Cyprus University of Technology,,,,,,,,,,,,,1.0,0.0
213,Incomplete Preferences in Single-Peaked Electorates,University of Vienna,,,,,,,,,,,,,1.0,0.0
214,Exploiting Competition Relationship for Robust Visual Recognition,Temple University,Temple University,,,,,,,,,,,,2.0,0.0
215,Large-Scale Analogical Reasoning,SRI International,SRI International,SRI International,SRI International,SRI International,,,,,,,,,5.0,0.0
216,Tractability through Exchangeability: A New Perspective on Efficient Probabilistic Inference,University of Washington,California State University Los Angeles,KU Leuven,,,,,,,,,,,3.0,0.0
217,A Model for Aggregating Contributions of Synergistic Crowdsourcing Workflows,Beihang University,Beihang University,Beihang University,Beihang University,University of Ottawa,,,,,,,,,5.0,0.0
218,An Agent-Based Model Studying the Acquisition of a Language System of Logical Constructions,Universitat Politècnica de Catalunya,,,,,,,,,,,,,1.0,0.0
219,Scalable Complex Contract Negotiation With Structured Search and Agenda Management,University of Massachusetts Dartmouth,University of Massachusetts Dartmouth,"Center for Collective Intelligence MIT Sloan School of Management Cambridge, MA, U.S.A",University of Alcalá,,,,,,,,,,3.0,0.0
220,Learning from Unscripted Deictic Gesture and Language for Human-Robot Interactions,University of Washington,University of Washington,University of Washington,,,,,,,,,,,3.0,0.0
221,Echo-State Conditional Restricted Boltzmann Machines,Cyprus University of Technology,,,,,,,,,,,,,1.0,0.0
222,Solving Zero-Sum Security Games in Discretized Spatio-Temporal Domains,University of Southern California,University of Southern California,University of Southern California,Duke University,University of Southern California,University of Southern California,,,,,,,,6.0,0.0
223,Prices Matter for the Parameterized Complexity of Shift Bribery,Technical University of Berlin,K+S (Germany),Technical University of Berlin,K+S (Germany),AGH University of Science and Technology,Technical University of Berlin,K+S (Germany),Technical University of Berlin,K+S (Germany),,,,,5.0,0.0
224,Efficient Optimization for Autonomous Robotic Manipulation of Natural Objects,Carnegie Mellon University,Carnegie Mellon University,Carnegie Mellon University,,,,,,,,,,,3.0,0.0
225,Semantic Segmentation Using Multiple Graphs with Block-Diagonal Constraints,Fudan University,Fudan University,Fudan University,Fudan University,,,,,,,,,,4.0,0.0
226,Computing Contingent Plans via Fully Observable Non-Deterministic Planning,University of Toronto,University of Toronto,University of Toronto,,,,,,,,,,,3.0,0.0
227,Model AI Assignments 2014,Michigan Technological University,University of Illinois Urbana-Champaign,Rochester Institute of Technology,University of Southern Mississippi,,,,,,,,,,4.0,0.0
228,A Characterization of the Single-Peaked Single-Crossing Domain,University of Oxford,Allegheny General Hospital,University of Warsaw,,,,,,,,,,,3.0,0.0
229,RepRev: Mitigating the Negative Effects of Misreported Ratings,Nanyang Technological University,Nanyang Technological University,Nanyang Technological University,Nanyang Technological University,Nanyang Technological University,Nanyang Technological University,,,,,,,,6.0,0.0
230,Supervised Hashing for Image Retrieval via Image Representation Learning,Sun Yat-sen University,Sun Yat-sen University,Sun Yat-sen University,National University of Singapore,Sun Yat-sen University,National University of Singapore,,,,,,,,6.0,0.0
231,Learning Unknown Event Models,Knexus Research (United States),United States Naval Research Laboratory,,,,,,,,,,,,1.0,1.0
232,Modeling and Predicting Popularity Dynamics via Reinforced Poisson Processes,Chinese Academy of Sciences,IBM Research - Thomas J. Watson Research Center,University of Miami,Northeastern University,,,,,,,,,,4.0,0.0
233,THink: Inferring Cognitive Status from Subtle Behaviors,Cambridge–MIT Institute,Neurology Department Drexel College of Med,Boston University,Cambridge–MIT Institute,Department of Neurology Lahey Healt,,,,,,,,,4.0,0.0
234,A Game-Theoretic Analysis of Catalog Optimization,University of Toronto,University of Toronto,University of Toronto,,,,,,,,,,,3.0,0.0
235,Multi-Organ Exchange: The Whole Is Greater than the Sum of its Parts,Carnegie Mellon University,Carnegie Mellon University,,,,,,,,,,,,2.0,0.0
236,"Betting Strategies, Market Selection, and the Wisdom of Crowds",Northwestern University,New York City Council,Santa Fe Institute,Carnegie Mellon University,,,,,,,,,,4.0,0.0
237,LASS: A Simple Assignment Model with Laplacian Smoothing,"University of California, Merced","University of California, Merced",,,,,,,,,,,,2.0,0.0
238,Confident Reasoning on Raven's Progressive Matrices Tests,Georgia Institute of Technology,Georgia Institute of Technology,,,,,,,,,,,,2.0,0.0
239,Recovering from Selection Bias in Causal and Statistical Inference,"University of California, Los Angeles",Iowa State University,"University of California, Los Angeles",,,,,,,,,,,3.0,0.0
240,On the Incompatibility of Efficiency and Strategyproofness in Randomized Social Choice,Data61,Technical University of Munich,Technical University of Munich,,,,,,,,,,,3.0,0.0
241,On the Axiomatic Characterization of Runoff Voting Rules,Duke University,Duke University,Duke University,,,,,,,,,,,3.0,0.0
242,Spatio-Temporal Consistency as a Means to Identify Unlabeled Objects in a Continuous Data Field,University of Minnesota,University of Minnesota,Rochester Institute of Technology,University of Minnesota,,,,,,,,,,4.0,0.0
243,Converting Instance Checking to Subsumption: A Rethink for Object Queries over Practical Ontologies,University of Miami,University of Miami,University of Miami,,,,,,,,,,,3.0,0.0
244,Social Planning: Achieving Goals by Altering Others' Mental States,University of Auckland,University of Auckland,University of Auckland,University of Auckland,,,,,,,,,,4.0,0.0
245,Towards Topological-Transformation Robust Shape Comparison: A Sparse Representation Based Manifold Embedding Approach,Fudan University,Fudan University,,,,,,,,,,,,2.0,0.0
246,Efficient Object Detection via Adaptive Online Selection of Sensor-Array Elements,,,,,,,,,,,,,,0.0,0.0
247,Binary Aggregation by Selection of the Most Representative Voter,University of Amsterdam,Department of Mathematics University of Padova Ital,,,,,,,,,,,,2.0,0.0
248,Decentralized Stochastic Planning with Anonymity in Interactions,Massachusetts Institute of Technology,Singapore Management University,,,,,,,,,,,,2.0,0.0
249,On Hair Recognition in the Wild by Machine,Michigan State University,Michigan State University,,,,,,,,,,,,2.0,0.0
250,Acquiring Comparative Commonsense Knowledge from the Web,Max Planck Institute for Informatics,Tsinghua University,Max Planck Institute for Informatics,,,,,,,,,,,3.0,0.0
251,A Multiarmed Bandit Incentive Mechanism for Crowdsourcing Demand Response in Smart Grids,Indian Institute of Science Bangalore,Catholic University of the Sacred Heart,Indian Institute of Science Bangalore,,,,,,,,,,,3.0,0.0
252,GenEth: A General Ethical Dilemma Analyzer,University of Hartford,Connecticut College,,,,,,,,,,,,1.0,0.0
253,Regret-Based Optimization and Preference Elicitation for Stackelberg Security Games with Uncertainty,University of Southern California,University of Southern California,Nanyang Technological University,University of Southern California,University of Toronto,,,,,,,,,5.0,0.0
254,Dynamic Multi-Agent Task Allocation with Spatial and Temporal Constraints,Ben-Gurion University of the Negev,Ben-Gurion University of the Negev,Ben-Gurion University of the Negev,,,,,,,,,,,3.0,0.0
255,Dropout Training for Support Vector Machines,Tsinghua University,Tsinghua University,Tsinghua University,Tsinghua University,,,,,,,,,,4.0,0.0
256,Mind the Gap: Machine Translation by Minimizing the Semantic Gap in Embedding Space,Institute of Automation,Microsoft Research Asia (China),Microsoft Research Asia (China),Microsoft Research Asia (China),Institute of Automation,,,,,,,,,2.0,3.0
257,Joule Counting Correction for Electric Vehicles Using Artificial Neural Networks,Carnegie Mellon University,,,,,,,,,,,,,1.0,0.0
258,Feature-Cost Sensitive Learning with Submodular Trees of Classifiers,Washington University in St. Louis,Tsinghua University,,,,,,,,,,,,2.0,0.0
259,Representing Words as Lymphocytes,Harbin Institute of Technology,Harbin Institute of Technology,Harbin Institute of Technology,,,,,,,,,,,3.0,0.0
260,Preference Elicitation and Interview Minimization in Stable Matchings,Computer Science Department,Computer Science Department,,,,,,,,,,,,2.0,0.0
261,Supervised Scoring with Monotone Multidimensional Splines,U.S. Green Building Council,,,,,,,,,,,,,1.0,0.0
262,Computing Preferences Based on Agents' Beliefs *,Tsinghua University,University of Science and Technology Beijing,,,,,,,,,,,,2.0,0.0
263,Explanation-Based Approximate Weighted Model Counting for Probabilistic Logics,KU Leuven,KU Leuven,KU Leuven,KU Leuven,,,,,,,,,,4.0,0.0
264,A Smart Range Helping Cognitively-Impaired Persons Cooking,Université du Québec à Chicoutimi,Université du Québec à Chicoutimi,Université du Québec à Chicoutimi,,,,,,,,,,,3.0,0.0
265,Game-heoretic Resource Allocation for Protecting Large Public Events,University of Chinese Academy of Sciences,Nanyang Technological University,"Department of Computer Science Virginia Tech Blacksburg, VA 2406",,,,,,,,,,,3.0,0.0
266,A Generalization of Probabilistic Serial to Randomized Social Choice,Data61,Technical University of Munich,,,,,,,,,,,,2.0,0.0
267,Testable Implications of Linear Structural Equation Models,"University of California, Los Angeles",Iowa State University,"University of California, Los Angeles",,,,,,,,,,,3.0,0.0
268,Saturated Path-Constrained MDP: Planning Under Uncertainty and Deterministic Model-Checking Constraints,"ONERA -The French Aerospace Lab 2 Avenue Édouard-Belin, F-31055 Toulouse, Franc","ONERA -The French Aerospace Lab 2 Avenue Édouard-Belin, F-31055 Toulouse, Franc",Microsoft (United States),,,,,,,,,,,0.0,1.0
269,On the Structure of Synergies in Cooperative Games,Carnegie Mellon University,Carnegie Mellon University,Carnegie Mellon University,,,,,,,,,,,3.0,0.0
270,Modeling and Mining Spatiotemporal Patterns of Infection Risk from Heterogeneous Data for Active Surveillance Planning,Jilin University,Academia Sinica,Jilin University,Jilin University,Hong Kong Baptist University,National Institute for Parasitic Diseases,Hong Kong Baptist University,,,,,,,7.0,0.0
271,Hybrid Heterogeneous Transfer Learning through Deep Learning,Nanyang Technological University,Institute for Infocomm Research,University of Technology Sydney,University of Queensland,,,,,,,,,,4.0,0.0
