Unnamed: 0,title,inst1,inst2,inst3,inst4,inst5,inst6,inst7,inst8,inst9,inst10,inst11,inst12,inst13,num_academia,num_company
272,SUIT: A Supervised User-Item Based Topic Model for Sentiment Analysis,Search for Extraterrestrial Intelligence,University of Illinois Urbana-Champaign,Chinese Academy of Sciences,Peking University,,,,,,,,,,4.0,0.0
273,Qualitative Reasoning with Modelica Models,Palo Alto Research Center,Palo Alto Research Center,Palo Alto Research Center,Palo Alto Research Center,,,,,,,,,,4.0,0.0
274,Semi-Supervised Matrix Completion for Cross-Lingual Text Classification,Temple University,Temple University,,,,,,,,,,,,2.0,0.0
275,Exploiting Support Sets for Answer Set Programs with External Evaluations *,"Institute of Information Systems, Vienna University of Technology Favoritenstraße 9-11, A-1040 Vienna, Austri","Institute of Information Systems, Vienna University of Technology Favoritenstraße 9-11, A-1040 Vienna, Austri","Institute of Information Systems, Vienna University of Technology Favoritenstraße 9-11, A-1040 Vienna, Austri","Institute of Information Systems, Vienna University of Technology Favoritenstraße 9-11, A-1040 Vienna, Austri",,,,,,,,,,4.0,0.0
276,A Control Dichotomy for Pure Scoring Rules *,Rochester Institute of Technology,University of Rochester,Kiel University,,,,,,,,,,,3.0,0.0
277,Active Learning for Crowdsourcing Using Knowledge Transfer,University of Technology Sydney,Commonwealth Scientific and Industrial Research Organisation,University of Technology Sydney,,,,,,,,,,,3.0,0.0
278,Flexible and Scalable Partially Observable Planning with Linear Translations,Simón Bolívar University,Institució Catalana de Recerca i Estudis Avançats,,,,,,,,,,,,2.0,0.0
279,Cost-Based Query Optimization via AI Planning,Australian National University,University of Toronto,University of Waterloo,University of Toronto,,,,,,,,,,4.0,0.0
280,Tightening Bounds for Bayesian Network Structure Learning,"Queens College, CUNY","Queens College, CUNY",University of Helsinki,,,,,,,,,,,3.0,0.0
281,Content-Structural Relation Inference in Knowledge Base,Institute of Computing Technology,Zhengzhou University,Institute of Computing Technology,Institute of Computing Technology,Institute of Computing Technology,,,,,,,,,5.0,0.0
282,Data Clustering by Laplacian Regularized 1 -Graph,University of Illinois Urbana-Champaign,University of Illinois Urbana-Champaign,Adobe Systems (United States),University of Illinois Urbana-Champaign,University of Illinois Urbana-Champaign,University of Illinois Urbana-Champaign,,,,,,,,5.0,1.0
283,Grandpa Hates Robots -Interaction Constraints for Planning in Inhabited Environments,Örebro University,Örebro University,Örebro University,,,,,,,,,,,3.0,0.0
284,Coactive Learning for Locally Optimal Problem Solving,Oregon State University,Oregon State University,Oregon State University,,,,,,,,,,,3.0,0.0
285,User Intent Identification from Online Discussions Using a Joint Aspect-Action Topic Model,National University of Singapore,National University of Singapore,,,,,,,,,,,,2.0,0.0
286,Cross-View Feature Learning for Scalable Social Image Analysis,Peking University,Peking University,Peking University,,,,,,,,,,,3.0,0.0
287,Data Quality in Ontology-Based Data Access: The Case of Consistency,Sapienza University of Rome,Sapienza University of Rome,,,,,,,,,,,,2.0,0.0
288,Direct Semantic Analysis for Social Image Classification,Renmin University of China,Ministry of Education of the People's Republic of China,Peking University,Renmin University of China,,,,,,,,,,4.0,0.0
289,Managing Change in Graph-Structured Data Using Description Logics,"Institute of Information Systems Vienna Univ. of Technology, Austri",Free University of Bozen-Bolzano,"Institute of Information Systems Vienna Univ. of Technology, Austri","Institute of Information Systems Vienna Univ. of Technology, Austri",,,,,,,,,,3.0,0.0
290,Social Capital in Network Organizations,Southern Illinois University Carbondale,Southern Illinois University Carbondale,,,,,,,,,,,,2.0,0.0
291,Querying Inconsistent Description Logic Knowledge Bases under Preferred Repair Semantics,French National Centre for Scientific Research,University of Rennes," Lannion, Franc",,,,,,,,,,,3.0,0.0
292,Evaluation and Deployment of a People-to-People Recommender in Online Dating,UNSW Sydney,University of Tasmania,Institute of Computer Science,,,,,,,,,,,3.0,0.0
293,Combining Heterogenous Social and Geographical Information for Event Recommendation,Institute of Computing Technology,University of Chinese Academy of Sciences,Institute of Information Engineering,Institute of Information Engineering,Institute of Information Engineering,Institute of Information Engineering,Institute of Computing Technology,,,,,,,7.0,0.0
294,Robot Team Exploration with Communication Restrictions,University of Minnesota,,,,,,,,,,,,,1.0,0.0
295,"Non-Convex Feature Learning via p,∞ Operator",The University of Texas at Arlington,The University of Texas at Arlington,,,,,,,,,,,,2.0,0.0
296,Feature Selection at the Discrete Limit,The University of Texas at Arlington,The University of Texas at Arlington,Shanghai Jiao Tong University,The University of Texas at Arlington,,,,,,,,,,4.0,0.0
297,Proceedings of the Nineteenth AAAI/SIGAI Doctoral Consortium,,,,,,,,,,,,,,0.0,0.0
298,Towards Scalable Exploration of Diagnoses in an Ontology Stream,Trinity College Dublin,,,,,,,,,,,,,1.0,0.0
299,A Speech-Driven Second Screen Application for TV Program Discovery,Shanghai Jiao Tong University,Shanghai Jiao Tong University,Shanghai Jiao Tong University,Shanghai Jiao Tong University,Shanghai Jiao Tong University,Shanghai Jiao Tong University,Shanghai Jiao Tong University,Shanghai Jiao Tong University,Shanghai Jiao Tong University,Shanghai Jiao Tong University,,,,10.0,0.0
300,A Strategy-Aware Technique for Learning Behaviors from Discrete Human Feedback,North Carolina State University,University of Jamestown,Washington State University,Washington State University,Brown University,Brown University,North Carolina State University,,,,,,,6.0,0.0
301,A Constructive Argumentation Framework,University of Montpellier,"CRIL -UMR 8188, University of Artois F-62307 Lens Cedex, Franc",,,,,,,,,,,,2.0,0.0
302,The Quest Draft: an Automated Course Allocation Algorithm,Quest University Canada,Quest University Canada,,,,,,,,,,,,2.0,0.0
303,Source Free Transfer Learning for Text Classification,Hong Kong University of Science and Technology,Hong Kong University of Science and Technology,Institute for Infocomm Research," Baidu Inc., Chin",Chinese University of Hong Kong,Hong Kong University of Science and Technology,,,,,,,,5.0,0.0
304,A Convex Formulation for Semi-Supervised Multi-Label Feature Selection,University of Queensland,The University of Texas at Arlington,The University of Texas at Arlington,University of Queensland,The University of Texas at Arlington,,,,,,,,,5.0,0.0
305,Fast Consistency Checking of Very Large Real-World RCC-8 Constraint Networks Using Graph Partitioning,National and Kapodistrian University of Athens,National and Kapodistrian University of Athens,,,,,,,,,,,,2.0,0.0
306,Q-Intersection Algorithms for Constraint-Based Robust Parameter Estimation,"LAAS-CNRS Université Toulouse, Franc","LIRMM Université Montpellier, Franc","LIRMM SupAgro Montpellier, Franc","LINA EMN Nantes, Franc",,,,,,,,,,4.0,0.0
307,Similarity-Preserving Binary Signature for Linear Subspaces, State Key Laboratory of Intelligent Technology and Systems, Tsinghua National Laboratory for Information Science and Technology (TNList),Tsinghua University, State Key Laboratory of Intelligent Technology and Systems, Tsinghua National Laboratory for Information Science and Technology (TNList),Tsinghua University,National University of Singapore,The University of Texas at San Antonio, State Key Laboratory of Intelligent Technology and Systems, Tsinghua National Laboratory for Information Science and Technology (TNList),Tsinghua University,,,5.0,0.0
308,Crowdsourced Explanations for Humorous Internet Memes,National Taiwan University,National Taiwan University,,,,,,,,,,,,2.0,0.0
309,Online Multi-Task Learning via Sparse Dictionary Optimization,Franklin W. Olin College of Engineering,University of Pennsylvania,,,,,,,,,,,,2.0,0.0
310,Swissnoise: Online Polls with Game-Theoretic Incentives,École Polytechnique Fédérale de Lausanne,École Polytechnique Fédérale de Lausanne,,,,,,,,,,,,2.0,0.0
311,Event Recommendation in Event-Based Social Networks,Institute of Information Engineering,Institute of Information Engineering,Institute of Information Engineering,Institute of Information Engineering,Victoria University,Institute of Computing Technology,,,,,,,,6.0,0.0
312,STREETS: Game-Theoretic Traffic Patrolling with Exploration and Exploitation,University of Southern California,Singapore Management University,Singapore Management University,University of Southern California,,,,,,,,,,4.0,0.0
313,Solving Semantic Problems Using Contexts Extracted from Knowledge Graphs,,,,,,,,,,,,,,0.0,0.0
314,Sample-Adaptive Multiple Kernel Learning,National University of Defense Technology,University of Wollongong,University of Technology Sydney,National University of Defense Technology,,,,,,,,,,4.0,0.0
315,The Effect of Similarity Between Human and Machine Action Choices on Adaptive Automation Performance,Wright-Patterson Air Force Base,,,,,,,,,,,,,1.0,0.0
316,Large-Scale Optimistic Adaptive Submodularity,Team Industrial Services (United States),Palo Alto Center for Pulmonary Disease Prevention,University of Liverpool,Palo Alto Center for Pulmonary Disease Prevention,Computer Science Department,,,,,,,,,1.0,1.0
317,A Support-Based Algorithm for the Bi-Objective Pareto Constraint,Université Catholique de Louvain,Université Catholique de Louvain,,,,,,,,,,,,2.0,0.0
318,Robust Distance Metric Learning in the Presence of Label Noise,Nanjing University of Aeronautics and Astronautics,Nanjing University of Aeronautics and Astronautics,,,,,,,,,,,,2.0,0.0
319,Genotypic versus Behavioural Diversity for Teams of Programs Under the 4-v-3 Keepaway Soccer Task,Dalhousie University,Dalhousie University,,,,,,,,,,,,2.0,0.0
320,Double Configuration Checking in Stochastic Local Search for Satisfiability,Peking University,Chinese Academy of Sciences,National Institute of Information and Communications Technology,Peking University,Peking University,Griffith University,,,,,,,,6.0,0.0
321,The Semantic Interpretation of Trust in Multiagent Interactions,North Carolina State University,,,,,,,,,,,,,1.0,0.0
322,Probabilistic Planning with Reduced Models,University of Massachusetts Amherst,,,,,,,,,,,,,1.0,0.0
323,Cross-Lingual Knowledge Validation Based Taxonomy Derivation from Heterogeneous Online Wikis,Tsinghua University,Tsinghua University,Tsinghua University,Tsinghua University,Tsinghua University," Sogou Incorporation, Beijing, Chin"," Sogou Incorporation, Beijing, Chin",,,,,,,5.0,2.0
324,The Complexity of Reasoning with FODD and GFODD,Tufts University,Tufts University,,,,,,,,,,,,2.0,0.0
325,Anytime Active Learning,Illinois Institute of Technology,Illinois Institute of Technology,Illinois Institute of Technology,,,,,,,,,,,3.0,0.0
326,Solving the Traveling Tournament Problem by Packing Three-Vertex Paths,University of Kaiserslautern,Quest University Canada,National Institute of Informatics,University of Göttingen,,,,,,,,,,4.0,0.0
327,Robust Non-Negative Dictionary Learning,Beihang University,The University of Texas at Arlington,The University of Texas at Arlington,Anhui University,,,,,,,,,,4.0,0.0
328,Distribution-Aware Sampling and Weighted Model Counting for SAT * †,Indian Institute of Technology Bombay,"University of California, Berkeley",Rice University,"University of California, Berkeley",Rice University,,,,,,,,,5.0,0.0
329,Adaptive Knowledge Transfer for Multiple Instance Learning in Image Classification,Purdue University West Lafayette,Purdue University West Lafayette,Purdue University West Lafayette,,,,,,,,,,,3.0,0.0
330,Influence Maximization with Novelty Decay in Social Networks,Nanyang Technological University,Xidian University,Xidian University,Nanyang Technological University,Teesside University,Nanyang Technological University,Xidian University,Xidian University,,,,,,8.0,0.0
331,A Parameterized Complexity Analysis of Generalized CP-Nets,University of Vienna,University of Vienna,University of Vienna,University of Vienna,,,,,,,,,,4.0,0.0
332,Proximal Iteratively Reweighted Algorithm with Multiple Splitting for Nonconvex Sparsity Optimization,National University of Singapore,Beijing Jiaotong University,Peking University,National University of Singapore,,,,,,,,,,4.0,0.0
333,Sequential Click Prediction for Sponsored Search with Recurrent Neural Networks,Institute of Computing Technology,Fudan University,Nankai University,Tsinghua University,Microsoft Research (United Kingdom),Microsoft Research (United Kingdom),Institute of Computing Technology,Microsoft Research (United Kingdom),Microsoft Research Asia (China),,,,,5.0,4.0
334,Instance-Based Domain Adaptation in NLP via In-Target-Domain Logistic Approximation,Nanjing University of Science and Technology,Nanjing University of Science and Technology,Nanjing University of Science and Technology,Nanjing University of Science and Technology,,,,,,,,,,4.0,0.0
335,Automatic Game Design via Mechanic Generation,Georgia Institute of Technology,Georgia Institute of Technology,,,,,,,,,,,,2.0,0.0
336,Using The Matrix Ridge Approximation to Speedup Determinantal Point Processes Sampling Algorithms,Zhejiang University,Shanghai Jiao Tong University,,,,,,,,,,,,2.0,0.0
337,Exponential Deepening A* for Real-Time Agent-Centered Search,ISE Department Ben-Gurion University Israe,ISE Department Ben-Gurion University Israe,University of Denver,,,,,,,,,,,1.0,0.0
338,Globally and Locally Consistent Unsupervised Projection,Colorado School of Mines,The University of Texas at Arlington,The University of Texas at Arlington,,,,,,,,,,,3.0,0.0
339,Ordering Effects and Belief Adjustment in the Use of Comparison Shopping Agents,Bar-Ilan University,Ariel University,Bar-Ilan University,,,,,,,,,,,3.0,0.0
340,A Joint Optimization Model for Image Summarization Based on Image Content and Tags,Peking University,Peking University,Peking University,Johns Hopkins University,,,,,,,,,,4.0,0.0
341,Cached Iterative Weakening for Optimal Multi-Way Number Partitioning,"University of California, Los Angeles","University of California, Los Angeles",,,,,,,,,,,,2.0,0.0
342,Role-Aware Conformity Influence Modeling and Analysis in Social Networks,Tsinghua University,Tsinghua University,University of Illinois Urbana-Champaign,Tsinghua University,,,,,,,,,,4.0,0.0
343,Who Also Likes It? Generating the Most Persuasive Social Explanations in Recommender Systems,Zhejiang University,Simon Fraser University,Zhejiang University,Simon Fraser University,Zhejiang University,,,,,,,,,5.0,0.0
344,CiteSeerX: AI in a Digital Library Search Engine,Pennsylvania State University,Pennsylvania State University,Pennsylvania State University,Pennsylvania State University,Pennsylvania State University,University of North Texas,Pennsylvania State University,Pennsylvania State University,Pennsylvania State University,,,,,9.0,0.0
345,Abduction Framework for Repairing Incomplete EL Ontologies: Complexity Results and Algorithms,Swedish e-Science Research Centre,Swedish e-Science Research Centre,Swedish e-Science Research Centre,,,,,,,,,,,3.0,0.0
346,Ranking Tweets by Labeled and Collaboratively Selected Pairs with Transitive Closure,Institute of Computing Technology,Institute of Computing Technology,Google (United States),,,,,,,,,,,2.0,1.0
347,Online Social Spammer Detection,Arizona State University,Arizona State University,Arizona State University,,,,,,,,,,,3.0,0.0
348,Semantic Data Representation for Improving Tensor Factorization," NTT Software Innovation Center, NTT Corporation, 3-9-11 Midori-Cho, Musashino-Shi, Tokyo 180-8585 Japan 5",National Defense Academy of Japan,Rensselaer Polytechnic Institute,,,,,,,,,,,2.0,0.0
349,Symbolic Model Checking Epistemic Strategy Logic,UNSW Sydney,UNSW Sydney,,,,,,,,,,,,2.0,0.0
350,Delivering Guaranteed Display Ads under Reach and Frequency Requirements,"University of California, Irvine",Yahoo (United States),,,,,,,,,,,,1.0,1.0
351,Learning Instance Concepts from Multiple-Instance Data with Bags as Distributions,Case Western Reserve University,Case Western Reserve University,,,,,,,,,,,,2.0,0.0
352,Active Learning with Model Selection,Carnegie Mellon University,Microsoft Research (United Kingdom),Microsoft Research (United Kingdom),,,,,,,,,,,1.0,2.0
353,Sketch Recognition with Natural Correction and Editing,Shanghai Jiao Tong University," Microsoft Research, Beijing, P. R. Chin",Shanghai Jiao Tong University," Microsoft Research, Beijing, P. R. Chin",Microsoft Research Asia (China),,,,,,,,,2.0,1.0
354,ARIA: Asymmetry Resistant Instance Alignment,Pohang University of Science and Technology,Pohang University of Science and Technology,,,,,,,,,,,,2.0,0.0
355,A Reasoner for the RCC-5 and RCC-8 Calculi Extended with Constants,National and Kapodistrian University of Athens,National and Kapodistrian University of Athens,National and Kapodistrian University of Athens,,,,,,,,,,,3.0,0.0
356,Crowdsourcing for Multiple-Choice Question Answering,"University at Buffalo, State University of New York","University at Buffalo, State University of New York","University at Buffalo, State University of New York","University at Buffalo, State University of New York","University at Buffalo, State University of New York","University at Buffalo, State University of New York","University at Buffalo, State University of New York",,,,,,,7.0,0.0
357,Dramatis: A Computational Model of Suspense,Western New England University,Georgia Institute of Technology,,,,,,,,,,,,2.0,0.0
358,Quality-Based Learning for Web Data Classification,Chinese Academy of Sciences,Chinese Academy of Sciences,Chinese Academy of Sciences,Chinese Academy of Sciences,,,,,,,,,,4.0,0.0
359,Partial Multi-View Clustering *,Nanjing University,Nanjing University,Nanjing University,,,,,,,,,,,3.0,0.0
360,Designing Fast Absorbing Markov Chains,Cornell University,Cornell University,IBM Research - Thomas J. Watson Research Center,Cornell University,,,,,,,,,,4.0,0.0
361,Agent Behavior Prediction and Its Generalization Analysis,University of Science and Technology of China,University of Chinese Academy of Sciences,Microsoft Research (United Kingdom),Microsoft Research (United Kingdom),University of Science and Technology of China,Microsoft Research (United Kingdom),Microsoft Research Asia (China),,,,,,,3.0,4.0
362,Approximate Equilibrium and Incentivizing Social Coordination,Rensselaer Polytechnic Institute,Rensselaer Polytechnic Institute,,,,,,,,,,,,2.0,0.0
363,Learning Deep Representations for Graph Clustering,University of Science and Technology of China,Microsoft Research (United Kingdom),Tsinghua University,University of Science and Technology of China,Microsoft Research (United Kingdom),,,,,,,,,3.0,2.0
364,Adaptive Multi-Compositionality for Recursive Neural Models with Applications to Sentiment Analysis,Beihang University,Microsoft Research Asia (China),Microsoft Research Asia (China),Beihang University,Microsoft Research (India),,,,,,,,,2.0,3.0
365,"An Experimentally Efficient Method for (MSS,CoMSS) Partitioning",Artois University,Artois University,Artois University,,,,,,,,,,,3.0,0.0
366,Learning Relative Similarity by Stochastic Dual Coordinate Ascent,Nanyang Technological University,Nanyang Technological University,"Rutgers, The State University of New Jersey",Nanyang Technological University,Nanyang Technological University,,,,,,,,,5.0,0.0
367,The Computational Complexity of Structure-Based Causality,IBM Research - Haifa,King's College London,Cornell University,IBM Research - Haifa,,,,,,,,,,4.0,0.0
368,"Imputation, Social Choice, and Partial Preferences",University of Waterloo,,,,,,,,,,,,,1.0,0.0
369,Recommendation by Mining Multiple User Behaviors with Group Sparsity,Institute of Automation,Institute of Automation,Institute of Automation,Institute of Automation,Institute of Automation,,,,,,,,,5.0,0.0
370,Optimizing and Learning Diffusion Behaviors in Complex Network,University of Massachusetts Amherst,,,,,,,,,,,,,1.0,0.0
371,Backdoors into Heterogeneous Classes of SAT and CSP,UNSW Sydney,Indian Institute of Science Bangalore,Masaryk University,University of Vienna,University of Oxford,,,,,,,,,5.0,0.0
372,Online Search Algorithm Configuration,University College Cork,University College Cork,University College Cork,Paderborn University,,,,,,,,,,4.0,0.0
373,Decomposing Activities of Daily Living to Discover Routine Clusters,Human Computer Interaction (Switzerland),École Polytechnique Fédérale de Lausanne,Human Computer Interaction (Switzerland),,,,,,,,,,,1.0,2.0
374,Preprocessing for Propositional Model Counting,French National Centre for Scientific Research,French National Centre for Scientific Research,,,,,,,,,,,,2.0,0.0
375,Learning Low-Rank Representations with Classwise Block-Diagonal Structure for Robust Face Recognition,Institute of Automation,Institute of Automation,Nanjing University of Science and Technology,"University of Maryland, College Park",Institute of Automation,Institute of Automation,,,,,,,,6.0,0.0
376,Propagating Regular Counting Constraints,TEAM,Nantes Université,Uppsala University,Data61,,,,,,,,,,3.0,1.0
377,Mapping Users across Networks by Manifold Alignment on Hypergraph,"University of California, Santa Barbara",Northwest University,Zhejiang University,Zhejiang University,Zhejiang University,Zhejiang University,,,,,,,,6.0,0.0
378,Calibration-Free BCI Based Control,Inria Bordeaux - Sud-Ouest Research Centre,Universidad de Zaragoza,Inria Bordeaux - Sud-Ouest Research Centre,Inria Bordeaux - Sud-Ouest Research Centre,,,,,,,,,,4.0,0.0
379,Worst-Case Solution Quality Analysis When Not Re-Expanding Nodes in Best-First Search,University of Alberta,University of Denver,University of Alberta,,,,,,,,,,,3.0,0.0
380,Compilation Based Approaches to Probabilistic Planning -Thesis Summary,Ben-Gurion University of the Negev,,,,,,,,,,,,,1.0,0.0
381,Information Sharing for Care Coordination,Harvard University,,,,,,,,,,,,,1.0,0.0
382,Cross-Domain Metric Learning Based on Information Theory,Chinese Academy of Sciences,University of Science and Technology of China,,,,,,,,,,,,2.0,0.0
383,To Share or Not to Share? The Single Agent in a Team Decision Problem,Harvard University,Harvard University,Ben-Gurion University of the Negev,,,,,,,,,,,3.0,0.0
384,Robust Protection of Fisheries with COmPASS,University of Southern California,University of Southern California,University of Southern California,University of Southern California,U.S. Coast Guard Research Development Center and Atlantic Are,U.S. Coast Guard Research Development Center and Atlantic Are,,,,,,,,4.0,0.0
385,A Knowledge Representation that Models Memory in Narrative Comprehension,North Carolina State University,North Carolina State University,,,,,,,,,,,,2.0,0.0
386,A Hybrid Grammar-Based Approach for Learning and Recognizing Natural Hand Gestures,Bielefeld University,Bielefeld University,,,,,,,,,,,,2.0,0.0
387,Predicting Emotions in User-Generated Videos,Fudan University,Fudan University,,,,,,,,,,,,2.0,0.0
388,Association Rule Hiding Based on Evolutionary Multi-Objective Optimization by Removing Items,Harbin Institute of Technology,Harbin Institute of Technology,,,,,,,,,,,,2.0,0.0
389,Datalog Rewritability of Disjunctive Datalog Programs and Its Applications to Ontology Reasoning,University of Oxford,University of Oxford,University of Oxford,,,,,,,,,,,3.0,0.0
390,Knowledge Graph Embedding by Translating on Hyperplanes,Sun Yat-sen University,Microsoft Research Asia (China),Sun Yat-sen University,Microsoft Research Asia (China),,,,,,,,,,2.0,2.0
391,Hybrid Singular Value Thresholding for Tensor Completion,Wenzhou University,Stanford University,Wenzhou University,ShanghaiTech University,,,,,,,,,,4.0,0.0
392,Pay-As-You-Go OWL Query Answering Using a Triple Store,University of Oxford,University of Oxford,University of Oxford,University of Oxford,,,,,,,,,,4.0,0.0
393,Fast and Accurate Influence Maximization on Large Networks with Pruned Monte-Carlo Simulations,The University of Tokyo,Japan Science and Technology Agency,The University of Tokyo,Japan Science and Technology Agency,National Institute of Informatics," Preferred Infrastructure, Inc., Tokyo, Japan",National Institute of Informatics,Japan Science and Technology Agency,,,,,,3.0,1.0
394,SOML: Sparse Online Metric Learning with Application to Image Retrieval,Chinese Academy of Sciences,Institute of Computing Technology,Nanyang Technological University,University of Chinese Academy of Sciences,Nanyang Technological University,Chinese Academy of Sciences,Institute of Computing Technology,Chinese Academy of Sciences,Institute of Computing Technology,Nanyang Technological University,University of Chinese Academy of Sciences,Chinese Academy of Sciences,Institute of Computing Technology,13.0,0.0
395,Natural Temporal Difference Learning,University of Massachusetts Amherst,University of Massachusetts Amherst,,,,,,,,,,,,2.0,0.0
396,Can Agent Development Affect Developer's Strategy?,Bar-Ilan University,Bar-Ilan University,Bar-Ilan University,,,,,,,,,,,3.0,0.0
397,Emotion Classification in Microblog Texts Using Class Sequential Rules,Peking University,Peking University,,,,,,,,,,,,2.0,0.0
398,Clustering Species Accumulation Curves to Identify Skill Levels of Citizen Scientists Participating in the eBird Project,Oregon State University Cascades,Oregon State University Cascades,Cornell University,,,,,,,,,,,1.0,0.0
399,Living and Searching in the World: Object-Based State Estimation for Mobile Robots,Massachusetts Institute of Technology,,,,,,,,,,,,,1.0,0.0
400,Discovering Better AAAI Keywords via Clustering with Community-sourced Constraints,Tufts University,Brown University,Tufts University,,,,,,,,,,,3.0,0.0
